1452,"Cần bán nhà sát mặt tiền Trần Não, đường số 12 P. Bình An, Quận 2: 6x25m, nhà 1 trệt giá 2",9.0,140.0,8.0,20.5,1.0,1.0,435.0,32.0,9.0
1453,"Nhà MT bên cạnh the Vista An Phú, Quận 2: 4,55x25m, CN 114m2 giá chỉ 9.5 tỷ TL",9.0,114.0,10.0,9.5,3.0,1.0,388.0,30.0,9.0
1454,"Bán nhà mặt tiền đường 20m bên cạnh the Vista AN Phú, Quận 2_Siêu Phẩm kinh doanh. 8,2 tỷ",9.0,102.0,20.0,8.2,3.0,1.0,25.0,30.0,9.0
1455,"Bán nhà mặt tiền Xô Viết Nghệ Tĩnh 2 chiều, P25, Bình Thạnh: 4.7x18m, Trệt Lầu giá 18 tỷ",9.0,80.0,20.0,18.0,3.0,1.0,513.0,16.0,17.0
1456,"Bán nhà đẹp không đối thủ so sánh mặt tiền Xô Viết Nghệ Tĩnh, P25, Bình Thạnh, 3 tầng mới.",9.0,100.0,20.0,20.0,4.0,2.0,513.0,16.0,17.0
1457,"Căn hộ DV 35 phòng, thu nhập 190 tr/th, 29/18 đường D2, P25, Q. Bình Thạnh",9.0,144.0,10.0,28.8,34.0,4.0,89.0,16.0,17.0
1458,"Căn hộ DV 35 phòng, thu nhập 190 tr/th, 29/18 Đường D2, P25, Q. Bình Thạnh",9.0,144.0,6.0,29.0,35.0,6.0,89.0,16.0,17.0
1459,"Bán nhà HXH đường Tầm Vu, P26, Bình Thạnh: 5,4x20m. 2 tầng. Giá chỉ 8.5 tỷ. full nội thất.",9.0,108.0,4.0,8.5,4.0,2.0,487.0,17.0,17.0
1460,"Bán gấp nhà hẻm 8m đường Nguyễn Xí 2 chiều, ngay Bến Xe Miền Đông, 4.5x14m. 3 tầng mới.",9.0,62.0,12.0,8.5,4.0,2.0,307.0,17.0,17.0
1461,"Cần bán gấp nhà HXH 8m đường D2, phường 25, Bình Thạnh, 4x15m, 2 tầng giá chỉ 8,5 tỷ",9.0,60.0,8.0,8.5,2.0,1.0,89.0,16.0,17.0
1462,"Bán toà nhà đường Xô Viết Nghệ Tĩnh, P26, Bình Thạnh,401m2,1 hầm + 6 tầng TN 350tr/th",9.0,410.0,10.0,44.0,54.0,7.0,513.0,17.0,17.0
1463,"Bán nhà hẻm 12m Xô Viết Nghệ Tĩnh, P21, BT: 4x16m, 4 tầng 4PN giá 8,5 tỷ TL",9.0,60.0,12.0,8.5,4.0,4.0,513.0,13.0,17.0
1464,"Bán căn nhà đẹp 5 tầng đường Lê Quang Định, P7, Bình Thạnh. 5,5x12m, Giá chỉ 9 tỷ.",9.0,66.0,4.0,9.0,5.0,3.0,182.0,24.0,17.0
1465,"Bán nhà 1 sẹc hẻm 8m đường D2, Phường 25, Bình Thạnh. 4x14m, giá 8.5 tỷ TL.",9.0,56.0,8.0,8.5,2.0,1.0,89.0,16.0,17.0
1466,"Nhà đường Điện Biên Phủ, Phường 17, Bình Thạnh: 5,6x20m, Hầm 3 lầu giá chỉ 12,5 tỷ",9.0,112.0,8.0,12.5,6.0,3.0,551.0,10.0,17.0
1467,"Nhà đẹp phường 12, Bình Thạnh, 4,2x13,2m, 4 tầng mới cứng, giá chỉ 8,3 tỷ.",9.0,55.0,6.0,8.3,5.0,3.0,51.0,5.0,17.0
1468,"Bán nhà 2 tầng hẻm 7m đường Nơ Trang Long, Phường 12, Bình Thạnh: 4x24m, chỉ 10 tỷ",9.0,94.0,7.0,10.0,4.0,1.0,321.0,5.0,17.0
1469,"Nhà 1 lầu khuôn đất 5,5x20m, CN 100m2, HXH đường Xô Viết Nghệ Tĩnh, P26, BT giá chỉ 8,4 tỷ",9.0,100.0,5.0,8.4,3.0,1.0,513.0,17.0,17.0
1470,"Bán CHDV cực Hot đường Xô Viết Nghệ Tĩnh, Bình Thạnh: 20x23m, Hầm 7 lầu TN 350tr/th.",9.0,230.0,8.0,50.0,54.0,7.0,513.0,17.0,17.0
1471,"Bán nhà hẻm 12m rải nhựa đường 2 chiều quận Bình Thạnh, 4x24m, 3 tầng giá chỉ 9,5 tỷ.",9.0,96.0,12.0,9.5,4.0,2.0,307.0,17.0,17.0
1472,"Bán nhà hẻm 6m đường Bạch Đằng, Phường 24, Bình Thạnh: 4.1x15m, 3 tầng giá chỉ 8,5 tỷ TL",9.0,60.0,6.0,8.5,3.0,2.0,53.0,15.0,17.0
1473,"Bán nhà  cấp 4 hẻm xe tải p12 Bình Thạnh, 5,2x22m, vuông vức, Giá chỉ 11 tỷ.",9.0,115.0,7.0,11.0,2.0,1.0,51.0,5.0,17.0
1474,"Bán nhà hẻm 7m rải nhựa,đường 2 chiều, p26, Bình Thạnh: 4,5x15m, 3 lầu st giá chỉ 8,2 tỷ",9.0,68.0,7.0,8.2,4.0,2.0,307.0,17.0,17.0
1475,"Bán gấp nhà hẻm 8m phường 25, Bình Thạnh: 4x14m, 5 tầng giá chỉ 8,4 tỷ TL.",9.0,56.0,8.0,8.4,5.0,4.0,490.0,16.0,17.0
1476,"Bán nhà hẻm nội bộ 8m đường D2, phường 25, Bình Thạnh:4x17m, 4 tầng giá chỉ 9 tỷ TL",9.0,68.0,8.0,9.0,4.0,4.0,89.0,16.0,17.0
1477,"Bán văn phòng HXH Phan Đăng Lưu,P.7, Phú Nhuận, 4.2x21m, 3 tầng, HDT 40tr giá chỉ 12,5 tỷ.",9.0,86.0,7.0,12.5,3.0,3.0,336.0,24.0,20.0
1478,"Bán nhà HXH đường Tầm Vu, P26, Bình Thạnh: 5,4x20m 2 tầng giá chỉ 9 tỷ",9.0,100.0,4.0,9.0,3.0,1.0,487.0,17.0,17.0
1479,"Bán nhà 1 tầng HXH Đinh Tiên Hoàng, P1 Bình Thạnh, 4,5x17m,72m2 giá chỉ 9 tỷ",9.0,72.0,5.0,9.0,3.0,1.0,549.0,2.0,17.0
1480,"Nợ tiền ngân hàng bán gấp nhà hẻm 10m đường Ung Văn Khiêm, P.25, Bình Thạnh. 100m2 3 lầu",9.0,100.0,8.0,14.0,4.0,2.0,490.0,16.0,17.0
1481,"Bán nhà HXH đường Điện Biên Phủ, P25, Bình Thanh:4.7x28m, CN 122m2, nhà c4 11 tỷ TL",9.0,122.0,5.0,11.0,2.0,1.0,551.0,16.0,17.0
1482,"Bán nhà hẻm 10m, cách mt 50m khu nội bộ an ninh P.26. BT, 4,5x22m, 3 tầng giá chỉ 9 tỷ.",9.0,100.0,10.0,9.0,4.0,2.0,356.0,17.0,17.0
1483,"Bán nhà hẻm 12m đường Nơ Trang Long, P.13, Bình Thạnh. 5.1x16m, 2 lầu HDT 20tr/th",9.0,80.0,12.0,7.5,4.0,2.0,321.0,6.0,17.0
1484,"Bán nhà hẻm 8m phường 25, Bình Thạnh, T,2L mới, 4x17m vuông vức giá chỉ 10 tỷ TL.",9.0,67.0,8.0,10.0,4.0,2.0,490.0,16.0,17.0
1485,"Bán nhà hẻm 8m đường Bùi Đình Túy, P12 Bình Thạnh: 4x20m 80m2, 2 lầu giá chỉ tầm 9 tỷ.",9.0,80.0,8.0,9.0,4.0,2.0,51.0,5.0,17.0
1486,"Bán nhà hẻm 12m ds9 phường Bình An, Quận 2, 8x18m, Trệt 3 lầu st giá chỉ 15 tỷ TL",9.0,128.0,12.0,15.0,6.0,4.0,388.0,32.0,9.0
1487,"Bán nhà 1 trệt 1 lầu sân thượng, 7x26m, CN 150m2, nhà mới full nội thất giá chỉ 14,5 tỷ TL",9.0,150.0,8.0,14.5,5.0,1.0,513.0,17.0,17.0
1488,"Bán nhà đường Phan Chu Trinh, P24, Bình Thạnh: 4,4x12m,3 lầu nội thất cơ bản giá 6 tỷ TL",9.0,48.0,3.0,6.0,5.0,3.0,325.0,15.0,17.0
1489,"Bán CHDV HDT khoán 60tr đường Xô Viết Nghệ Tĩnh, P26, Bình Thạnh, 5,5 tầng giá 12 tỷ TL",9.0,80.0,4.0,12.0,17.0,4.0,513.0,17.0,17.0
1490,"Bán nhà Bình Lợi, Phường 13, Bình Thạnh: 5x14m, 4 tầng full nội thất cao cấp, giá 9.5 tỷ",9.0,70.0,12.0,9.5,5.0,3.0,36.0,6.0,17.0
1491,"Bán căn hộ dịch vụ đường Bạch Đằng,P24, Bình Thạnh: 8x20m, 3 lầu st giá 24 tỷ TL",9.0,160.0,6.0,24.0,18.0,3.0,53.0,15.0,17.0
1492,"Nhà hẻm 10m phường 26,quận Bình Thạnh: 4.5x22m, 3 tầng, HDT 25tr/th, giá chỉ 10 tỷ.",9.0,99.0,10.0,10.0,4.0,3.0,356.0,17.0,17.0
1493,"Bán nhà HXH đường Tầm Vu, P26, Bình Thạnh: 5,4x20m 2 tầng giá chỉ 8.5 tỷ. Full nội thất",9.0,100.0,4.0,8.5,3.0,1.0,487.0,17.0,17.0
1494,"Bán CHDV 37 phòng HDT 170tr/th. 200m2 đất giá 29,5 tỷ TL",9.0,200.0,5.0,29.5,37.0,5.0,513.0,18.0,17.0
1495,"Bán nhà khu VIP Cư Xá Tự Do, Tân Bình, HXH, DT 43M2, chỉ 5.98 tỷ TL.",9.0,43.0,8.0,5.98,2.0,2.0,70.0,24.0,22.0
1496,"Bán nhà khu VIP Cách Mạng Tháng 8, Tân Bình, HXH, DT 44m2, giá 5.99 tỷ TL tốt.",9.0,44.0,8.0,5.99,2.0,2.0,70.0,24.0,22.0
1497,Nhà riêng HXH Khuông Việt 90m2 giá 6.7 tỷ Phú Trung Tân Phú.,9.0,90.0,8.0,6.7,3.0,1.0,156.0,72.0,23.0
1498,"Bán nhà MT Ngay chợ Cây Gõ Minh Phụng ,DT: 4x12 giá 5.6 tỷ P.9 Q.6",9.0,50.0,8.0,5.2,2.0,1.0,56.0,26.0,13.0
1499,"Khu VIP Bành Văn Trân, Tân Bình, HXH, DT 35m2, giá 4.18 tỷ TL.",9.0,35.0,4.0,4.18,2.0,2.0,33.0,24.0,22.0
1500,Nhà Hoà Hảo 38m2 giá 6.5 tỷ P.5 Q.10,9.0,38.0,4.0,6.5,4.0,2.0,138.0,21.0,6.0
1501,"Bán nhà ngang 4 Bà Hạt, Quận 10, DT 35m2, 3 tầng, giá 4.39 tỷ TL",9.0,35.0,3.0,4.39,3.0,3.0,29.0,25.0,6.0
1502,"Nhà mới Trường Chinh cạnh MT, DT 30m2, 3 tầng BTCT, giá chỉ 3.35 tỷ TL.",9.0,30.0,3.0,3.35,3.0,3.0,420.0,6.0,22.0
1503,Bán nhà đường 3/2 Quận 10 42m2 giá 5.8tỷ,9.0,42.0,8.0,5.8,3.0,2.0,21.0,4.0,6.0
1504,"Nhà đẹp Hòa Hưng, HXH Quận 10, DTS 30m2, giá 2.24 tỷ TL.",9.0,30.0,4.0,2.24,2.0,2.0,137.0,6.0,6.0
1505,MT Phan Đăng Lưu 3.5m x 11m giá 17.8 tỷ P.3 Q.Phú Nhuận,9.0,50.0,30.0,17.8,5.0,4.0,336.0,20.0,20.0
1506,Bán nhà Thành Thái Quận 10 34m2 giá 7.95 tỷ,9.0,34.0,6.0,7.95,3.0,3.0,395.0,5.0,6.0
1507,Nhà Căn góc Hòa Bình 68m2 giá 6.7 tỷ Q.11.,9.0,66.0,8.0,6.7,4.0,2.0,136.0,22.0,7.0
1508,MT Gia Phú  70m2  P.13 Q.5 giá 20 tỷ,9.0,70.0,30.0,20.0,5.0,3.0,105.0,6.0,12.0
1509,Bán nhà HXH Trịnh Đình Trọng  95m2 Q.Tân Phú giá 7.9 tỷ,9.0,95.0,8.0,7.9,15.0,4.0,456.0,55.0,23.0
1510,Bán nhà Quận 10 38m2 giá 4.9 tỷ,9.0,38.0,4.0,4.9,5.0,3.0,69.0,6.0,6.0
1511,Nhà mới ngay Bến xe miển tây 3lầu giá 4.5 tỷ Q.6,9.0,36.0,5.0,4.5,4.0,3.0,210.0,28.0,18.0
1512,Bán nhà HXH Vườn Lài  Q.Tân Phú 40m2 giá 3.7 tỷ,9.0,40.0,6.0,3.7,2.0,1.0,507.0,71.0,23.0
1513,Nhà riêng MT đường số 1C khu Tên lữa Q.BT giá 5.39 tỷ,9.0,50.0,8.0,5.39,4.0,2.0,370.0,28.0,18.0
1514,"Nhà hẻm Hương Lộ 2  DT: 5x12 P.Bình Trị Đông ,Bình Tân.",9.0,60.0,8.0,3.5,2.0,1.0,141.0,41.0,18.0
1515,Bán nhà  Q.6 Phú lâm 70m2 giá 5.8 tỷ,9.0,70.0,4.0,6.8,5.0,3.0,143.0,4.0,13.0
1516,Bán nhà HXH Quận 6 44m2 giá 2.85 tỷ,9.0,22.0,6.0,2.85,2.0,1.0,80.0,6.0,13.0
1517,MẶT TIỀN ĐƯỜNG VIP BÌNH TÂN - NGAY AEON MALL BÌNH TÂN.,9.0,60.0,60.0,11.0,2.0,2.0,475.0,29.0,18.0
1518,"1 căn MT duy nhất còn sót lại TT Phú Nhuận, 93m2, ko lộ giới, chỉ 9.1 tỷ",9.0,93.0,15.0,9.1,2.0,2.0,400.0,21.0,20.0
1519,"NHÀ MẶT TIỀN KINH DOANH VÍP - GẦN SÂN BAY 130m2,ngang 5.5m,HIẾM (Hầm+5L) chỉ 20 tỷ TL",9.0,130.0,15.0,20.0,8.0,6.0,291.0,20.0,19.0
1520,"Mặt tiền Bình Thạnh 65m2, 5L, giá chỉ 9.4 tỷ thu nhập 40tr/tháng",9.0,65.0,10.0,9.4,7.0,5.0,193.0,22.0,17.0
1521,"Bán gấp Mặt tiền KD Nguyễn Thượng Hiền 80m2,5L mới,nở hậu,chỉ 12.5 tỷ",9.0,80.0,15.0,12.5,5.0,5.0,275.0,20.0,17.0
1522,"Bán gấp nhà mặt tiền Nguyễn Văn Đậu, 8L thang máy thu nhập 200tr/tháng nhỉnh 19 tỷ",9.0,80.0,15.0,19.0,25.0,8.0,304.0,22.0,20.0
1523,"Bán nhà góc 2 mặt tiền Nơ Trang Long, Bình Thạnh, 106m2 giá 11.8 tỷ",9.0,106.0,6.0,11.8,4.0,4.0,321.0,4.0,17.0
1524,"Mặt tiền kinh doanh đỉnh VIP Tân Bình 48m2(4x11) vuông vức, chỉ nhỉnh 5 tỷ",9.0,48.0,8.0,5.8,2.0,3.0,361.0,4.0,22.0
1525,"Mặt tiền CMT8,P13, Quận 10, 4 lầu mới(3.7x14) chỉ 10.7 tỷ",9.0,52.0,20.0,10.7,4.0,4.0,69.0,6.0,6.0
1526,"Mặt tiền hiếmTrung tâm Q10, 4 lầu mới, 56m2, giá nhỉnh 10 tỷ",9.0,56.0,20.0,10.5,5.0,4.0,69.0,6.0,6.0
1527,"Quân 10, đường 3/2, cho thuê giữ tiền 50tr/thg, 62m2 chỉ 7.9 tỷ",9.0,62.0,4.0,7.9,13.0,5.0,21.0,4.0,6.0
1528,"Bán gấp nhà Lê Quang Định, bình thạnh hẻm 8m,sau căn mặt tiền 80m2 giá 10 tỷ",9.0,80.0,8.0,10.0,5.0,4.0,182.0,22.0,17.0
1529,"Cô Hoa nhờ bán nhà trung tâm Quận 10, Sát mặt tiền CHỈ 3.5 TỶ.",9.0,28.0,3.5,3.5,3.0,4.0,138.0,21.0,6.0
1530,"BÁN GẤP NHÀ MỚI KHU VIP ĐƯỜNG D2,80m2, 4L, chỉ 12.4 tỷ Sát Quận 1.(1 căn duy nhất)",9.0,80.0,9.0,12.4,5.0,4.0,89.0,16.0,17.0
1531,"Khu VIP TT Bình Thạnh, Đường D2, 70m2,vuông vức, nhà mới 4L,chỉ 11.4 tỷ Cực Hiếm.",9.0,70.0,8.0,11.4,6.0,4.0,89.0,16.0,17.0
1532,"Đầu tư mọi thể loại, 124m2, Cách MT Lê quang Định 1 căn, HXH quay đầu, chỉ 11.4 tỷ TL",9.0,124.0,8.0,11.4,4.0,2.0,182.0,2.0,17.0
1533,"Bán nhà HXH Tô Hiến Thành,Q.10, 4.5x15m, trệt 3 lầu. Nhà mới 100%, 11 tỷ TL",9.0,65.0,5.0,11.0,5.0,4.0,476.0,8.0,6.0
1534,"Nhà mới 5L BTCT, Đinh Tiên Hoàng, 87m2, giá chỉ 10.4 tỷ LH Tiên xem nhà ngay",9.0,87.0,5.0,10.4,6.0,5.0,549.0,2.0,17.0
1535,"Nhà mới 5L BTCT, Đinh Tiên Hoàng, 87m2, giá chỉ 10.4 tỷ LH Tiên xem nhà ngay",9.0,87.0,5.0,10.4,6.0,5.0,549.0,2.0,17.0
1536,"Bán gâp nhà mặt tiền Bình Thạnh, nở hậu, 5L, 76m2 giá chỉ 10.8 tỷ Ở + Kinh Doanh",9.0,75.0,8.0,10.8,5.0,5.0,182.0,24.0,17.0
1537,"Chưa qua Đầu tư  Khu Vip Phan Đăng Lưu, 68m2, HXH,giá chỉ 7 tỷ",9.0,68.0,5.0,7.0,3.0,2.0,336.0,2.0,20.0
1538,"Cần bán nhanh nhà HXH Thích Quảng Đức,5x12, 5L đúc,54m2, giá chỉ 6.66 tỷ",9.0,54.0,4.0,6.66,4.0,5.0,400.0,21.0,20.0
1539,"Mặt tiền Kinh Doanh VIP TT  Bình Thạnh 60m2, 5L mới, giá  nhỉnh 9 tỷ",9.0,60.0,8.0,9.4,4.0,5.0,193.0,23.0,17.0
1540,"Nhỉnh 10 tỷ có ngay biệt thự sang chảnh 76m2, TT Bình Thạnh, 4LSát Mặt tiền",9.0,76.0,8.0,10.0,4.0,4.0,307.0,17.0,17.0
1541,"Nhà nát  Phú Nhuận 180m2,HXH, 9x20m(CHDV, CTY,VP, SPA) chỉ 23.5 tỷ",9.0,180.0,5.0,23.5,3.0,1.0,131.0,6.0,20.0
1542,"Nợ NH cần bán nhà HXH 112m2 CN chỉ 4,4 tỷ ngay khu Vip Cityland, GVấp",9.0,112.0,4.0,4.4,2.0,1.0,296.0,9.0,19.0
1543,"1 căn duy nhất 140m2(5x27) CN, chỉ 7 tỷ TL Trung tâm Tân Bình",9.0,140.0,4.0,7.0,2.0,1.0,327.0,4.0,22.0
1544,Giá đầu tư - Xây CHDV Đ.Nơ Trang Long 90m2 (5.7x15m) chỉ 8 tỷ,9.0,90.0,4.0,8.0,2.0,1.0,321.0,5.0,17.0
1545,"Bán nhà Phan Xích Long, Phú Nhuận. Hẻm xe tải 4.8x14m giá 8.9 tỷ Tl.",9.0,67.0,6.0,8.9,4.0,4.0,334.0,2.0,20.0
1546,"Chủ ngộp ngân hàng bán nhanh 125m2, HXH Nguyễn Văn Lượng,CHỈ  4.9 tỷ TL MẠNH",9.0,125.0,4.5,4.9,3.0,2.0,296.0,9.0,19.0
1547,"Bán nhà HXH 178 Phan Đăng Lưu, Quận Phú Nhuận, dt 4,5x20m, giá 10 tỷ",9.0,90.0,6.0,10.0,4.0,4.0,336.0,20.0,20.0
1548,"Nhà mới 41m2, 6.3 tỷ HXH thông Phan Xích Long, Phú Nhuận. LH trực tiếp Cô Tiên",9.0,41.0,6.0,6.3,3.0,2.0,334.0,20.0,20.0
1549,"Giá tốt cho đầu tư- bán gấp nhà HXH Nguyễn Văn Lượng 110m2, chỉ 5.3 tỷ",9.0,110.0,5.0,5.3,2.0,2.0,296.0,9.0,19.0
1550,"Lô góc kinh doanh hẻm 42 Hoàng Hoa Thám,P7,Bình Thạnh, 80m2, giá  9.2 tỷ",9.0,80.0,10.0,9.2,2.0,2.0,118.0,24.0,17.0
1551,Bán nhà hẻm xe tải Hoàng Hoa Thám (5x15m)  nhỉnh 9 tỷ 1 đời chủ,9.0,79.0,8.0,9.0,3.0,3.0,118.0,23.0,17.0
1552,"Bán nhà quận bình thạnh chính chủ 96m2 ngang 4,3m, 5Lâu 15 tỷ TN 72tr/tháng",9.0,96.0,10.0,15.0,7.0,5.0,182.0,22.0,17.0
1553,Nhà mới HXH Hoàng Hoa Thám 45m2 5L đúc chỉ 6.7 tỷ Cực hiếm trong Khu Vực,9.0,45.0,4.0,6.7,4.0,5.0,118.0,22.0,20.0
1554,Kẹt nợ bán gấp nhà Lê Quang Định 8x10m2 công nhận giá chỉ 5.9 tỷ,9.0,78.0,4.0,5.9,5.0,2.0,182.0,22.0,17.0
1555,"1 đời chủ - HXH 7 chỗ  Lạc Long Quân (4x13) 2L đúc, chỉ 5.4 tỷ",9.0,52.0,6.0,5.4,3.0,3.0,220.0,25.0,22.0
1556,"Nhà mới ở ngay HXH Lạc Long Quân, 4L Đúc, chỉ 5.8 tỷ",9.0,48.0,5.0,5.8,4.0,4.0,220.0,25.0,22.0
1557,"HXH nhựa 6m, gần mặt tiền Huỳnh Văn Bánh,4.5x15 sổ đẹp, 4L đúc, 9.45 tỷ TL",9.0,68.0,6.0,9.45,6.0,4.0,131.0,4.0,20.0
1558,"Bán nhà HXH khu VIP Phan Xích Long, 4 tấm, (5.7x12.6m) giá chỉ 9.5 tỷ",9.0,70.0,6.0,9.5,6.0,4.0,334.0,12.0,20.0
1559,"Chủ ngộp NH cần bán nhanh 210m2, HXH chỉ 11 tỷ khu VIP Cityland GV",9.0,210.0,4.0,11.0,5.0,2.0,296.0,9.0,19.0
1560,"Khu VIP Vườn Chuối, ở+ Kinh Doanh đủ thể loại,4 lầu mới, nhỉnh 7 tỷ",9.0,42.0,7.0,7.0,4.0,4.0,506.0,2.0,10.0
1561,Bán gấp lô góc ở + Kinh doanh 48M2 Quận 3 HXH giá chỉ 5.7 tỷ HIẾM,9.0,48.0,4.0,5.7,4.0,4.0,506.0,2.0,10.0
1562,"BÁN GẤP NHÀ CMT8, QUẬN 10,HXH 30M2 ĐÚC BTCT, GIÁ CHỈ 3.2 TỶ",9.0,30.0,4.0,3.2,3.0,3.0,69.0,6.0,6.0
1563,"1 đời chủ sát chợ Bà Chiểu Bình Thạnh, 5.4x10.7m nở hậu, chỉ 5.6 tỷ",9.0,55.0,5.0,5.6,3.0,2.0,43.0,12.0,17.0
1564,"HIẾM Vườn chuối Quận 3 , 5 tầng ,32m2 giá chỉ 5,25 tỷ Chưa qua đầu tư",9.0,32.0,3.5,5.25,4.0,5.0,506.0,21.0,10.0
1565,"1 căn duy nhất Vườn chuối Trung tâm Quận 3,5 lầu đúc, chỉ 5.2 tỷ 1 đời chủ.",9.0,30.0,4.0,5.2,4.0,5.0,506.0,21.0,10.0
1566,"Bán gấp nhà Nguyễn Thiện Thuật Quận 3,40m2, 4L mới chỉ 6 tỷ",9.0,40.0,4.0,6.0,4.0,4.0,270.0,20.0,10.0
1567,"Kẹt tiền, bán nhà Tô Hiến Thành, HXH, 50m2, giá chỉ 5.6 tỷ",9.0,50.0,4.0,5.6,4.0,3.0,476.0,3.0,6.0
1568,"TN gần 40tr/thg Bán gấp nhà 80m2, Tô Hiến Thành, Quận 10, giá 6,8 tỷ. Hiếm",9.0,80.0,4.0,6.8,8.0,3.0,476.0,8.0,6.0
1569,"Bán nhà đường 3/2 Quận 10  - HXH 1 trệt 2 lầu, 5 tỷ, 4PN Hiếm",9.0,40.0,4.0,5.0,4.0,3.0,476.0,8.0,6.0
1570,"1 căn duy nhất Trung tâm Quận 10, 3 tầng đúc, 30m2,chỉ 3 tỷ giá quá tốt.",9.0,30.0,4.0,3.0,3.0,3.0,147.0,2.0,6.0
1571,"1 căn duy nhất Tô Hiến Thành sát MT 3.6x9m, 4L đúc chỉ 3.8 tỷ",9.0,33.0,3.5,3.8,3.0,4.0,476.0,8.0,6.0
1572,CHỈ 3.7 TỶ CÓ NGAY NHÀ 5 TẦNG QUẬN 10-HOÀN CÔNG ĐẦY ĐỦ- NHÀ CÒN MỚI VÀO Ở NGAY,9.0,28.0,4.0,3.7,4.0,5.0,247.0,20.0,6.0
1573,Cần bán gấp nhà mới Lê Hồng Phong 38m2 4 tầng giá chỉ 3.9 tỷ.,9.0,38.0,4.0,3.9,3.0,4.0,173.0,2.0,6.0
1574,"Bán gấp nhà đẹp cách MT lý Thái Tổ 1 căn, 4.6 tỷ 4 tầng đúc.",9.0,36.0,4.0,4.7,3.0,4.0,214.0,26.0,6.0
1575,Bán nhà hẻm xe hơi thẳng trục 6mx11m Sư Vạn Hạnh Quận 10 giá 8.9 tỷ TL,9.0,66.0,6.0,8.8,3.0,3.0,363.0,5.0,6.0
1576,"Bán nhà hẻm nhựa 8m đường sư vạn hạnh P12 Q10 DT:4,2x20m 3 lầu Giá 16.8 tỷ",9.0,90.0,8.0,16.8,5.0,4.0,363.0,4.0,6.0
1577,"CHÍNH CHỦ BÁN NHÀ HXH ĐƯỜNG TÔ HIẾN THÀNH, QUẬN 10 – 106m2, nhỉnh 110tr/m2",9.0,106.0,6.0,12.5,5.0,4.0,476.0,8.0,6.0
1578,"Đầu tư(CHDV,SPA,CTY…) 120m2, 5x24m chỉ 100tr/m2 HXH Trung tâm Quận 10.",9.0,120.0,5.0,12.4,3.0,2.0,69.0,8.0,6.0
1579,"Trung tâm Quận 10, 62m2(5.7x11m) HXH, 4 lầu mới, chỉ 9.7 tỷ",9.0,62.0,5.0,9.7,5.0,4.0,137.0,6.0,6.0
1580,"Kẹt tiền bán gấp lô góc C4 hẻm 8m Sư Vạn Hạnh, Quận 10(7x17m) GPXD hầm 7L nhỉnh 28 tỷ",9.0,120.0,8.0,28.0,2.0,1.0,363.0,3.0,6.0
1581,"Hẻm 8m Sư Vạn Hạnh quận 10, view Vạn Hạnh Mall, HĐT 90tr/th, chỉ 26 tỷ",9.0,100.0,8.0,26.0,20.0,5.0,363.0,3.0,6.0
1582,"Tôi cần bán nhà 5x23m Lê Hồng Phong nối dài–THU NHẬP GẦN 150TR/THÁNG-sổ hồng, giá 26.8 tỷ",9.0,117.0,6.0,26.8,20.0,6.0,173.0,2.0,6.0
1583,"Trung tâm Quận 3, 145m2 7L Thang máy, 20CHDV Cao Cấp TN 150tr/thg chỉ 27 tỷ",9.0,145.0,8.0,27.0,20.0,7.0,495.0,25.0,10.0
1584,"Bán gấp khách sạn hầm 5 lầu Nguyễn Tri Phương, Thu Nhập 130tr/tháng",9.0,108.0,8.0,27.0,22.0,6.0,283.0,26.0,6.0
1585,"Siêu phẩm biệt thự Sát Quận 10, 60m2, 3L đúc mới-hẻm nhựa 6m chỉ 7.8 tỷ",9.0,6.0,6.0,7.8,4.0,3.0,33.0,24.0,22.0
1586,"Lô lóc thoáng mát 42m2, 3 LẦU MỚI GIÁ 5,7 tỷ đường Tô Hiến Thành",9.0,42.0,4.0,5.7,4.0,4.0,476.0,23.0,6.0
1587,"Nhà mới-Ở ngay 4PN Tô Hiến Thành Quận 10, DT 38m2 giá 5.5 tỷ TL",9.0,38.0,4.0,5.5,4.0,4.0,476.0,6.0,6.0
1588,"HXH nhựa 6m Tô Hiến Thành Quận 10, 40m2, 3 lầu giá chỉ 5.85 tỷ. CỰC HIẾM",9.0,40.0,6.0,5.85,4.0,4.0,476.0,23.0,6.0
1589,"Trung tâm Quận 10, HXH, CMT8 (4x12m) Nhà mới vào ở ngay. Chỉ 5.6 tỷ",9.0,46.0,4.0,5.6,3.0,3.0,69.0,4.0,6.0
1590,"Chưa qua Đtư- Hẻm nhựa 6m đường Âu Cơ 55m2, giá chỉ 6.2 tỷ lh Tiên gặp chủ xem nhà",9.0,55.0,6.0,6.2,3.0,2.0,544.0,26.0,22.0
1591,"Nhà mới ở ngay trung tâm Quận 10, 4.5x12m sổ vuông, chỉ 6.8 tỷ",9.0,50.0,4.0,6.8,4.0,4.0,69.0,23.0,6.0
1592,"1 căn duy nhất TT Quận 10, HXH 4L mới ở ngay giá chỉ 7.6 tỷ",9.0,45.0,4.0,7.6,4.0,4.0,476.0,3.0,6.0
1593,1 căn duy nhất 21m2(3.5x6) 3 tầng đúc giá chỉ 2.4 tỷ TT Quận 10.,9.0,21.0,3.0,2.4,2.0,3.0,69.0,23.0,6.0
1594,"Nhà mới 4 lầu ngay hẻm 163 Tô Hiến Thành, 39m2, chỉ 5.6 tỷ,5PN",9.0,39.0,4.0,5.6,5.0,4.0,476.0,3.0,6.0
1595,"1 đời chủ- Giáp Quận 10,60m2,4 tầng đúc hẻm nhựa 8m, giá chỉ 8.9 tỷ",9.0,60.0,8.0,8.9,4.0,4.0,70.0,26.0,22.0
1596,"1 căn duy nhất Sát Mặt tiền CMT8, xe hơi tránh 66m2, 3L, chỉ 8.8 tỷ",9.0,66.0,10.0,8.8,4.0,3.0,69.0,23.0,6.0
1597,"Nhà CMT8 P15 Quận 10, 78m2, 3 Lầu, HXH, 10.2 Tỷ.",9.0,78.0,6.0,10.2,5.0,3.0,69.0,8.0,6.0
1598,"Sát Mặt tiền CMT8, 90m2,hẻm 8m, 3L mới chỉ 11.5 tỷ",9.0,90.0,8.0,11.5,4.0,3.0,70.0,3.0,22.0
1599,"1 đời chủ HXH-80m2, 4x20m2, vuông vức, Trung Tâm Quận 10, chỉ 8.9 tỷ",9.0,80.0,4.0,8.9,3.0,2.0,69.0,6.0,6.0
1600,"Nợ ngân hàng cần bán nhà HXH Tô Hiến Thành, 40m2, 3 tầng, 3PN rộng, chỉ 4.3 tỷ Hiếm",9.0,40.0,4.0,4.3,3.0,3.0,476.0,8.0,6.0
1601,"NHÀ ĐẸP CMT8 ,QUẬN 10 ,59M2 ,4Lầu BTCT,CHỈ 6.4 TỶ, XE HƠI VÀO NHÀ* CỰC HIẾM *",9.0,59.0,7.0,6.4,5.0,4.0,69.0,6.0,6.0
1602,"Bán nhà HXH Ngô Gia tự, 50m2, 4.5X12m, 4PN rộng, mới-ở ngay, chỉ 6.5 tỷ.",9.0,50.0,4.0,6.5,4.0,4.0,313.0,12.0,6.0
1603,"Bán gấp nhà HXH Thành Thái, Quận 10,Nhà 1 trệt 3 lầu – 56m2 chỉ 6 tỷ.",9.0,56.0,4.0,6.0,5.0,4.0,395.0,8.0,6.0
1604,"BÁN LÔ GÓC HẺM KINH DOANH 4m QUẬN 10, 48m2 GIÁ 5.9 TỶ.",9.0,48.0,4.0,5.9,4.0,3.0,173.0,2.0,6.0
1605,"Nhà mới Nguyễn Tri Phương Quận 10, 44m2, hẻm 5m chỉ 5,7 tỷ.",9.0,44.0,4.0,5.7,4.0,4.0,283.0,25.0,6.0
1606,"1 căn duy nhất Trung tâm Quận 10, Cao Thắng,ở+KD, 5PN, 4 lầu mới, chỉ 6.2 tỷ",9.0,50.0,4.0,6.2,5.0,4.0,63.0,5.0,6.0
1607,"Hẻm nhựa 6m,Cách mạng Tháng Tám,Quận 3, 56m2, 4L đúc, chỉ 6.5 tỷ CỰC HIẾM",9.0,56.0,6.0,6.5,4.0,4.0,69.0,3.0,10.0
1608,"Kẹt nợ bán gấp nhà Nguyễn Đình Chiểu, Quận 3,50m2,4L, chỉ 7 tỷ Ở+ Kinh Doanh",9.0,50.0,4.0,7.0,3.0,4.0,309.0,12.0,10.0
1609,"Hẻm xe tải Cách Mạng Tháng Tám, Quận 10, 90m2, chỉ 7.8 tỷ Chưa Qua Đầu tư.",9.0,90.0,6.0,7.8,4.0,4.0,69.0,6.0,6.0
1610,"Trung tâm Quận 10, 80m2, chưa tới 100tr/m2(5x19), hẻm 6m CỰC HIẾM.",9.0,80.0,6.0,7.7,6.0,4.0,69.0,6.0,6.0
1611,Nhà mới- ở ngay 3 tầng đúc-Lý Thái Tổ 3.5 x 9.5 giá 4.7 tỷ Phường 9 Quận 10,9.0,34.0,3.5,4.7,3.0,4.0,214.0,26.0,6.0
1612,Xe hơi vào nhà HIẾM Sát MT Lý Thái Tổ 4L đúc mới – 66m2 nở hậu chỉ 9.8 tỷ,9.0,66.0,7.0,9.8,5.0,4.0,214.0,26.0,6.0
1613,"Nhà HXH Lê Hồng Phong 4L mới ở+ cho thuê  30tr/thg, 64m2, 4L mới, 9.7 tỷ",9.0,64.0,6.0,9.7,5.0,4.0,173.0,25.0,6.0
1614,"Hẻm xe hơi Tô Hiến Thành 3 lầu mới, có thang máy VIP, chỉ 8 tỷ",9.0,60.0,5.0,8.0,4.0,3.0,476.0,3.0,6.0
1615,"Trung tâm Quận 10, 70m2, chỉ 7 tỷ hẻm 4m cách MT 70m, 4PN rộng.",9.0,70.0,4.0,7.0,4.0,3.0,476.0,8.0,6.0
1616,Cam kết nhà thật - Mặt Tiền Quận 11- Kinh doanh - 5PN- chỉ 6.6 tỷ,9.0,38.0,10.0,6.6,5.0,5.0,205.0,5.0,7.0
1617,Cam kết Nhà thật- Quận 1-Kinh doanh-45m2- Giá 6.5 Tỷ,9.0,45.0,5.0,6.5,4.0,4.0,428.0,48.0,5.0
1618,"Cam kết nhà thật - mới ở ngay CMT8, 56m2(4.3x12m) chỉ 5.5 tỷ.",9.0,56.0,3.5,5.5,3.0,2.0,70.0,24.0,22.0
1619,"MT kinh doanh đỉnh-Lý Thái Tổ 6 lầu mới, 18CHDV-TN gần 90tr/tháng chỉ 22 tỷ TL",9.0,104.0,20.0,22.0,18.0,6.0,214.0,26.0,6.0
1620,"Nhà mới Tô hiến Thành-Chưa qua đtư 36m2, 3 lầu đúc - chỉ 4.2 TL",9.0,36.0,3.5,4.2,3.0,4.0,476.0,3.0,6.0
1621,"Nhà mới- ở ngay CMT8, 3 tầng đúc, 3PN rộng, giá chỉ 5,4 tỷ TL",9.0,54.0,3.5,5.4,3.0,2.0,69.0,6.0,6.0
1622,"Cực hiếm Nhà mới Tô Hiến Thành, 5 tầng Thang máy, 5PN khép kín chỉ 10 tỷ",9.0,62.0,4.0,10.0,5.0,5.0,476.0,8.0,6.0
1623,"Cam kết tin thật 100%-Bán gấp 14CHDV Cao cấp đường 3/2, thu nhập 55tr/thg chỉ 7.95tỷ",9.0,64.0,4.0,7.95,14.0,5.0,27.0,9.0,7.0
1624,"Đtư dòng tiền-bán gấp 20CHDV cao cấp p3, Bình Thạnh,125m2,TN 100tr/thg",9.0,125.0,5.0,16.0,20.0,6.0,508.0,20.0,17.0
1625,"Khu VIP Quận 3, Nguyễn Đình Chiểu, nhà mới HXH, 5 lầu đúc, chỉ 6.5 tỷ",9.0,34.0,5.0,6.5,5.0,5.0,309.0,12.0,10.0
1626,"Hẻm 4m, CMT8, Quận 10, 3.7x10m, nhà mới ở ngay chỉ 4.95 tỷ",9.0,27.0,3.5,4.95,3.0,2.0,69.0,6.0,6.0
1627,"Trung tâm Quận 10,CMT8,38m2,2L đúc nội thất xịn chỉ 5 tỷ thương lượng",9.0,38.0,3.5,5.0,3.0,3.0,69.0,5.0,6.0
1628,"Kẹt nợ hạ ngay 1 tỷ nhà hẻm nhựa 10m, CMT8,62m2,4L mới, chỉ 8.4 tỷ",9.0,62.0,8.0,8.4,4.0,4.0,69.0,3.0,6.0
1629,"Bán gấp nhà CMT8 60m2, xe hơi vào nhà,3L mới, chỉ 7.8 tỷ CỰC HIẾM",9.0,60.0,6.0,7.8,4.0,3.0,70.0,22.0,22.0
1630,"Hiếm nhà hẻm nhựa 10m, ở + Kinh doanh, 4L đúc, vuông vức, chỉ 4.2 tỷ",9.0,24.0,10.0,4.2,3.0,4.0,69.0,6.0,6.0
1631,Biệt thự MT Q.2 80n2 gúa 15.5 tỷ,9.0,80.0,20.0,15.5,6.0,4.0,377.0,30.0,9.0
1632,MT Âu Cơ 68m2 gía 10.5 tỷ Tân Sơn Nhì Q. Tân Phú,9.0,68.0,18.0,10.5,4.0,3.0,544.0,95.0,23.0
1633,Nhà riêng MT Ấp Chiến lược  giá 5.4 tỷ  Q.Bình Tân.,9.0,70.0,30.0,5.4,2.0,1.0,456.0,72.0,23.0
1634,Bán Nhà Cầm Bá Thước Q.Phú Nhuận 32m2 giá 4.6 tỷ,9.0,32.0,4.0,4.6,2.0,2.0,82.0,24.0,20.0
1635,Bán Nhà Cầm Bá Thước Q.Phú Nhuận 32m2 giá 4.6 tỷ,9.0,32.0,4.0,4.6,2.0,2.0,82.0,24.0,20.0
1636,Nhà bán Bà Hom Quận 6 40m2 giá 3.9 tỷ,9.0,44.0,3.0,3.9,2.0,1.0,28.0,6.0,13.0
1637,Bán nhà riêng tại Đường Tân Hóa DT: 5x28  giá 10.2 tỷ Phường 1 Quận 11.,9.0,140.0,8.0,10.2,2.0,1.0,460.0,2.0,7.0
1638,Nhà mới cư xá đô thành 30m2 Q.3 giá 4.3 tỷ,9.0,30.0,3.0,4.3,4.0,2.0,81.0,21.0,10.0
1639,"Bánhà phố Hưng Gia đường lớn giá tốt nhất thị trường hiện tại, vị trí sát bên Sky garden 3",9.0,111.0,10.0,25.5,4.0,4.0,42.0,91.0,14.0
1640,Nhà HXH  Thái Phiên 34m2 giá 4.5 tỷ Quận 11,9.0,34.0,6.0,4.5,4.0,2.0,396.0,25.0,7.0
1641,Bán nhà Quận 10 50m2 giá 10.8tỷ,9.0,50.0,8.0,10.8,2.0,1.0,63.0,5.0,6.0
1642,"Hạ Giá Bán gấp nhà MT Đường Phan Đăng Lưu, Quận PN. Diện tích: 8x20m 1T 4L Giá 50tỷ",9.0,180.0,30.0,50.0,5.0,4.0,336.0,24.0,20.0
1643,"Bán MT ngang lớn Đường Phan Xích Long, Quận Phú Nhuận. DT 8x18m Giá 57tỷ GPXD Hầm 7L",9.0,144.0,30.0,57.0,1.0,1.0,334.0,12.0,20.0
1644,"Bán MT rẻ nhất Đường Huỳnh Văn Bánh, Quận PN. DT 8x20m NH: 13m, 1T 2L Giá 45 tỷ (TL)",9.0,205.0,16.0,45.0,3.0,2.0,131.0,4.0,20.0
1645,"Bán nhà MT vị trí cực đẹp đường Bạch Đằng, TB. DT 4.8x10m, 1T 4L Giá chỉ 14 tỷ (TL)",9.0,140.0,30.0,14.0,5.0,4.0,53.0,12.0,22.0
