733,"Vỡ Nợ Bán Gấp Nhà Nát Phan Văn Trị, Q. Gò Vấp-60m2-1.1tỷ-Tiện ở",8.0,60.0,6.0,1.1,2.0,1.0,333.0,8.0,19.0
734,"THUA LỖ BÁN GẤP NHÀ NÁT NGUYỄN CỬU VÂN P17 BÌNH THẠNH 1TỶ70/68m² SHR,GẦN CHỢ, GẦN TRƯỜNG",8.0,68.0,6.0,1.07,1.0,1.0,244.0,16.0,17.0
735,"VỠ NỢ BÁN NHÀ NÁT HOA LAN P.7 PN 72M2/1TỶ140 SHR, GẦN CHỢ,GẦN UBND CHÍNH CHỦ BÁN LH LAN VY",8.0,72.0,6.0,1.14,1.0,1.0,113.0,24.0,20.0
736,"Bán Gấp Nhà Nát Âu Cơ, TB- 980TR/52M2-SHR- GẦN CHỢ TIỆN KD ĐẦU TƯ",8.0,52.0,6.0,0.98,1.0,1.0,544.0,3.0,22.0
737,"THUA LỖ CHỨNG KHOÁN BÁN GẤP NHÀ NÁT Đ.PHAN VĂN TRỊ ,GV DT 65M2/980tr SHR, GẦN CHỢ",8.0,65.0,6.0,0.98,1.0,1.0,333.0,24.0,19.0
738,"Cần bán gấp nhà nát đường Lê Đại Hành,Q10-1.1TỶ/60M2-GẦN UBND",8.0,60.0,6.0,1.1,2.0,1.0,205.0,24.0,6.0
739,"VỀ QUÊ BÁN NHÀ NÁT DUY TÂN Q.PN 61M2/975TR SHR, GẦN CHỢ, CHÍNH CHỦ BÁN GẤP- lh VY",8.0,61.0,6.0,0.975,1.0,1.0,95.0,8.0,20.0
740,"VỠ NỢ BÁN GẤP NHÀ NÁT VŨ TÙNG PHƯỜNG2 BÌNH THẠNH 990TR/57m² SHR, GẦN CHỢ, GẦN TRƯỜNG",8.0,57.0,6.0,0.99,1.0,1.0,505.0,12.0,17.0
741,"Phú Nhuận đắc địa, 3 Tầng, 12m2, hẻm 3m, Gía chỉ 1.98 tỷ",8.0,12.0,3.0,1.98,2.0,3.0,338.0,24.0,20.0
742,ĐỊNH CƯ MỸ - BÁN GẤP NHÀ NÁT BÌNH THỚI - 64M2 – 1.1 TỶ - SHR - TIỆN Ở -,8.0,65.0,4.0,1.1,1.0,1.0,40.0,22.0,7.0
743,ĐẦU TƯ BÁN GẤP NHÀ NÁT LÊ HỒNG PHONG-60M2-980TR-CÓ SỔ-CHÍNH CHỦ,8.0,60.0,4.0,0.89,1.0,1.0,173.0,12.0,12.0
744,"Cần tiền trả nợ bán gấp nhà nát chính chủ ở đường Bùi Đình tuy 60m,2 1ty",8.0,60.0,4.0,1.0,1.0,1.0,51.0,23.0,17.0
745,"Gia đình tôi qua Úc định cư nên cần bán gấp nhà nát đường Thành Thái, q10 60,m2 1,2 ty",8.0,60.0,4.0,1.2,1.0,1.0,395.0,7.0,6.0
746,"Li dị vợ bán gấp nhà nát Lạc Long Quân, Q. 11 DT 65m2 giá TT 1.12 tỷ SHR gần chợ",8.0,65.0,4.0,1.12,1.0,1.0,220.0,22.0,7.0
747,Qua Mỹ định cư bán gấp nhà nát Thành Thái 60m2 1.15 tỷ sổ hồng bao sang tên gần,8.0,60.0,4.0,1.12,2.0,1.0,395.0,21.0,6.0
748,Bán nhà cao thắng phường 5 quận 10 1 tỷ 530 40m2 shr,8.0,40.0,4.0,1.83,2.0,1.0,63.0,22.0,6.0
749,Bán gấp nhà tôn đản phường 4 quận 4 1 tỷ 830 42m2 shr,8.0,42.0,4.0,1.83,2.0,1.0,480.0,21.0,11.0
750,"VỠ NỢ-BÁN GẤP NHÀ NÁT TÔ HIẾN THÀNH-60M2-895TR-Gần chợ-chính chủ,có sổ-LH (Tuệ Nhi)",8.0,60.0,5.0,0.895,1.0,1.0,476.0,6.0,6.0
751,LI DỊ CHỒNG-BÁN GẤP NHÀ NÁT HỒ BÁ KIỆN-60M2-925TR-SHR-XDTD-LH  (TUỆ NHI),8.0,60.0,6.0,0.925,2.0,1.0,145.0,8.0,6.0
752,MỞ SHOP-BÁN GẤP NHÀ NÁT CHỦ YẾU LẤY ĐẤT HUỲNH MẪN ĐẠT-60M2-955tr-SHR-LH  (NHI),8.0,60.0,6.0,0.955,2.0,1.0,126.0,24.0,12.0
753,"Chơi chứng khoán, tôi bán gấp nhà Tô Hiến Thành-60m2/985tr-chính chủ-sổ hồng-gần siêu thị",8.0,60.0,6.0,0.985,2.0,1.0,476.0,6.0,6.0
754,Nhà 1 lầu 3PN.2WC Mai Văn Vĩnh P.Tân Quy Q7 - HXH - SHR 47m2,8.0,47.0,5.0,1.599,3.0,1.0,225.0,93.0,14.0
755,"Bán gấp nhà mặt tiền Bình Phú, P11, Quận 6 nhà 2 mặt tiền DT: 20x25m, DT hiếm có giá 68 tỷ",8.0,500.0,25.0,68.0,4.0,2.0,37.0,4.0,13.0
756,"Kẹt tiền cần bán gấp nhà mặt tiền Nguyễn Văn Luông P11, Quận 6 DT 4x27m giá chỉ 22 tỷ",8.0,110.0,30.0,22.0,3.0,2.0,295.0,5.0,13.0
757,Bán nhà hoàng diệu phường 6 quận 4 1t1l 1 tỷ 840 48m2 shr,8.0,48.0,4.0,1.84,2.0,1.0,115.0,23.0,11.0
758,"Định cư nước ngoài bán gấp  nhà Trần Bình Trọng, p1- Q10, 43m2 giá 1 tỷ 520tr",8.0,43.0,4.0,1.52,2.0,1.0,425.0,2.0,6.0
759,Cần tiền trang trải cuộc sống cần bán gấp căn nhà nát ở minh phụng quận 10 giá 1 tỷ 1 40m2,8.0,40.0,4.0,1.19,1.0,1.0,227.0,3.0,7.0
760,Gia đình về quê cần bán gấp nhà ở lạc long quân quận tân bình gía 1 tỷ 4 48m2 SHR,8.0,48.0,5.0,1.91,1.0,1.0,220.0,5.0,22.0
761,Nhà hẻm thông D2 nối dài P25 B.Thạnh - HXH - SHR,8.0,41.0,4.0,2.625,3.0,2.0,89.0,16.0,17.0
762,Bán nhà lương định của phường bình khánh quận 2 1 tỷ 580 46m2 1 tỷ 680 shr,8.0,46.0,4.0,1.68,2.0,1.0,219.0,36.0,9.0
763,"Chuyển nhà về quê nên cần bán gấp lại căn hẻm Lê Hồng Phong, Q10- p1, 41m2 - giá 1 tỷ 530",8.0,41.0,3.0,1.53,2.0,1.0,173.0,2.0,6.0
764,Nhà cấp 4 cũ Xóm Chiếu P15 Q4 - HBG - SHR,8.0,39.0,3.0,1.2990000000000002,3.0,1.0,511.0,8.0,11.0
765,"Hiện đang cần tiền xoay nợ nên bán gấp nhà đường Linh Đông, Q Thủ Đức, 43m2 - giá 1 tỷ 490",8.0,43.0,4.0,1.49,2.0,1.0,162.0,60.0,21.0
766,"Nhà hẻm thông P.X.Long, P.Nhuận - SHR - HXT",8.0,33.0,5.0,2.35,2.0,1.0,334.0,24.0,20.0
767,Bán nhà nguyễn thị đình thủ đức 1t1l 2 pn 1 tỷ 910 44m2 shr,8.0,44.0,4.0,1.91,2.0,1.0,281.0,30.0,9.0
768,Nhà 3 lầu nở hậu N.Đ.Chiểu P4 P.Nhuận - HBGác - SHR,8.0,40.0,3.0,1.655,4.0,2.0,309.0,21.0,20.0
769,Gì em cần tiền bán gấp căn nhà cho thuê 8tr/tháng,8.0,120.0,6.0,1.2,4.0,1.0,140.0,131.0,0.0
770,Nhà hẻm thông 1/ B.Đình.Túy B.Thạnh - SHR - HXT,8.0,26.0,5.0,1.55,3.0,2.0,51.0,5.0,17.0
771,Bán nhà đường số 4 kp6 bình phước thủ đức 1 tỷ 770 48m2 shr,8.0,48.0,4.0,1.77,2.0,1.0,382.0,51.0,21.0
772,Bán nhà ở đường nguyễn văn đậu phường 12 quận bình thạnh,8.0,44.0,4.0,1.62,2.0,1.0,304.0,5.0,17.0
773,"Bán gấp nhà mặt tiền 1500m2 Nguyễn Thị Định, P.TML, Quận 2, giá chỉ 70 triệu/m2",8.0,1.5,10.0,105.0,6.0,3.0,281.0,81.0,9.0
774,"Bán biệt thự mặt tiền Giang Văn Minh, P.An Phú, Quận 2 (Dt 12x20m, Hầm 3 lầu) giá 65 tỷ",8.0,180.0,20.0,65.0,1.0,1.0,106.0,30.0,9.0
775,"Cần Bán tài sản 3120m2  mặt tiền đường An Phú, Quận 2 (đã xin GPXD cao tầng) giá 420 tỷ",8.0,3.12,12.0,0.42,1.0,1.0,25.0,30.0,9.0
776,"Bán khuôn đất  300m2(15x20m) MT đường Đặng Như Mai, TML, Q2(gần UBND Q2) giá 36 tỷ",8.0,300.0,16.0,36.0,1.0,1.0,569.0,81.0,9.0
777,"Bán khuôn đất MT Tạ Hiện-Đồng Văn Cống, P.TML, Quận 2(Dt 5x22m, CN 110m2) giá 18 tỷ",8.0,110.0,16.0,18.0,1.0,1.0,483.0,81.0,9.0
778,"Bán 5800m2 đất mặt tiền Phường Bình Trưng Tây, Quận 2 tiếp giáp Sông Giồng Ông Tố (28tr/m)",8.0,5.8,16.0,165.0,1.0,1.0,249.0,39.0,9.0
779,"Bán gấp nhà MT Vũ Tông Phan, Phường An Phú, Quận 2 (10x20m, trệt 3 lầu) giá 55 tỷ",8.0,200.0,30.0,55.0,5.0,3.0,504.0,30.0,9.0
780,"Bán siêu Biệt Thự MT đường số 20-Trần Não, Q2 View Landmark (15x18m, Hầm 3 lầu) giá 36 tỷ",8.0,180.0,12.0,36.0,5.0,3.0,435.0,32.0,9.0
781,"Bán biệt thự mặt tiền Đỗ Pháp Thuận, An Phú-An Khánh, Q2(10x20m, Hầm 4 tầng, NTCC) 35 tỷ",8.0,200.0,16.0,35.0,6.0,4.0,578.0,30.0,9.0
782,"Bán nhà MT Đinh Tiên Hoàng, Quận 1 (Dt 4x25m, NH 9m, CN 160m2. 4 tầng) giá chỉ 30 tỷ TL",8.0,160.0,20.0,30.0,6.0,4.0,549.0,106.0,5.0
783,"Bán MT đường số 21-Trần Não, Bình An, Quận 2 (Dt 15x17m, CN 252m2, XD Hầm 5 tầng), 36 tỷ",8.0,252.0,16.0,36.0,1.0,1.0,527.0,32.0,9.0
784,"Mặt tiền Bưng Ông Thoàn, Phú Hữu, Q9(DT 6825m2 full thổ cư hiện hữu) giá chỉ 25tr/m TL",8.0,6.825,30.0,170.0,1.0,1.0,52.0,67.0,16.0
785,"Bán nhà MT Lâm Quang Ky, Thạnh Mỹ Lợi, Q2(sát UBND Q2) 7x20m, trệt 2 lầu,4PN. Giá 22 tỷ",8.0,140.0,20.0,22.0,4.0,3.0,167.0,81.0,9.0
786,"Bán nhà phố Đường Nguyễn Ư Dĩ, Thảo Điền, Q2 (13x33m, CN 425m2, GPXD hầm 5 tầng) 35,5 tỷ",8.0,425.0,20.0,35.5,5.0,5.0,311.0,83.0,9.0
787,"Góc 2MT Võ Chí Công - Liên Phường, Phú Hữu, Quận 9 (DT 2300m2, ngay Vòng Xoay) XD cao tầng",8.0,2.3,50.0,130.0,1.0,1.0,492.0,67.0,16.0
788,"2 mặt tiền Nguyễn Văn Hưởng, Q2 đoạn xây dựng cao tầng (20x26m, CN 510m2) giá 110 tỷ",8.0,510.0,30.0,110.0,1.0,1.0,293.0,83.0,9.0
789,"Bán nhà 2 mặt tiền Mai Chí Thọ, An Khánh, Q2 gần cao tốc (15x18m, CN 265m2) giá 150tr/m",8.0,265.0,60.0,39.0,1.0,1.0,222.0,30.0,9.0
790,"{Siêu HOT}-4200m2 MT Vành Đai 2(Võ Chí Công), Cát Lái, Quận 2(XD 30 tầng) chỉ 30tr/m TL",8.0,4.2,60.0,120.0,1.0,1.0,492.0,46.0,9.0
791,"Bán 1500m2 mặt tiền Võ Chí Công_Liên Phường, Phú Hữu, Quận 9. Giá 82tr/m Thương Lượng",8.0,1.5,50.0,120.0,1.0,1.0,492.0,67.0,16.0
792,Bán 2710m2 mặt tiền Võ Chí Công (Vòng Xoay Liên phường) Quận 9 giá 75tr/m Thương Lượng,8.0,2.71,50.0,200.0,1.0,1.0,492.0,67.0,16.0
793,Nhà đẹp 4 x 14m 3 tấm rưỡi HXH Bùi Tư Toàn Q.Bình Tân HCM Hạnh,8.0,56.0,7.0,5.1,4.0,3.0,48.0,28.0,18.0
794,"Nhà đẹp 1 trệt 1 lầu DT 5 x 12m đường 2D nd Nam Hùng Vương, Bình Tân, HCM - 4 tỷ",8.0,60.0,6.0,4.0,3.0,2.0,375.0,28.0,18.0
795,"Đất biệt thự view sông Sài Gòn, đối diện Landmarl 81 đường Trần Não, 10x20, 42 tỷ",8.0,200.0,20.0,42.0,3.0,2.0,435.0,32.0,9.0
796,"Bán nhà 2MT 12 Trần Não, Bình An, quận 2. GPXD Hầm 7 tâng. 9x20 góc 2MT giá 25 tỷ",8.0,180.0,12.0,25.0,1.0,1.0,435.0,32.0,9.0
797,"Bán biệt thự - Văn phòng mặt tiền Nguyễn Quý Cảnh, An Phú, quận 2. DT 10x20 Hầm 3 lầu, 38T",8.0,200.0,20.0,38.0,4.0,3.0,268.0,30.0,9.0
798,"Bán nhà mặt tiền đường Song Hành, An Phú, Quận 2. Hầm 3 lầu, DT 7,5x20. Giá 40 tỷ",8.0,150.0,20.0,40.0,5.0,3.0,360.0,30.0,9.0
799,Bán nhà trọ 35 phòng hẻm 6m Tân Hương Tân Phú 5.4x23m đúc lửng 3 lầu ST (Nở hậu 8m),8.0,168.0,6.0,14.5,35.0,4.0,461.0,94.0,23.0
800,Cần bán nhà hồ bá phấn phường 6 quận 4 1 tỷ 490 40m2 shr,8.0,40.0,4.0,1.49,2.0,1.0,72.0,74.0,21.0
801,"Bán Nhà Cách Mạng Tháng 8 Phường 13 Quận 10. 48m2, 2 Tầng, 5,4 Tỷ",8.0,48.0,4.0,5.399,2.0,2.0,69.0,6.0,6.0
802,"Cần tiền gấp xoay sở nên bán gấp nhà hẻm lớn đường Xóm Đất, p10- Q11, 42m2 - giá 1 tỷ 460",8.0,42.0,3.5,1.46,2.0,1.0,512.0,3.0,7.0
803,Bán nhà nguyễn thiện thuật phường 3 quận 3 giá 1 tỷ 590 40m2 shr,8.0,40.0,6.0,1.57,2.0,1.0,270.0,20.0,10.0
804,Bán nhà như hình Phan Huy Ích p12.DT 4.5x10m trệt 2 lầu sân thượng,8.0,43.0,4.0,4.0,3.0,3.0,326.0,5.0,19.0
805,Bán nhà ở sư vạn hạnh  phường 12 quận 10 1 tỷ 760 50m2 shr,8.0,50.0,4.0,1.76,2.0,1.0,363.0,22.0,6.0
806,"Hiện tại do đang kẹt vốn nên bán gấp nhà hẻm lớn đường Lò Siêu, p12- Q11, 46m2 - giá1tỷ480",8.0,46.0,3.5,1.48,2.0,1.0,209.0,5.0,7.0
807,Bán nhà mặt tiền kinh doanh Lê Tự Tài quận Phú Nhuận.,8.0,36.0,15.0,7.4,4.0,4.0,194.0,26.0,20.0
808,Cần bán nhà hẻm 8m sau lưng mặt tiền Cộng Hoà Tân Bình,8.0,100.0,8.0,18.0,7.0,4.0,86.0,21.0,22.0
809,Chính chủ bán nhà mặt tiền chợ Tân Sơn Nhất Gò Vấp,8.0,72.0,15.0,14.2,6.0,4.0,291.0,20.0,19.0
810,cần bán nhà hẻm 6m Nguyễn Kiệm F3 Gò Vấp,8.0,56.0,6.0,5.0,2.0,1.0,260.0,20.0,19.0
811,Cần bán nhà hẻm 4m Nguyễn Văn Công phường 3 Gò Vấp,8.0,26.0,4.0,3.35,2.0,1.0,291.0,20.0,19.0
812,Cần bán nhà hẻm 6m Phan Đình Phùng quận Phú Nhuận,8.0,27.0,6.0,4.75,3.0,3.0,335.0,2.0,20.0
813,Cần bán nhà hẻm 7m Đặng Văn Ngữ quận Phú Nhuận,8.0,40.0,7.0,8.3,5.0,3.0,571.0,7.0,20.0
814,Cần bán nhà 2 mặt hẻm 10m Lê Văn Sĩ quận Phú Nhuận,8.0,65.0,10.0,16.4,8.0,6.0,199.0,3.0,20.0
815,Cần bán nhà hẻm 3m Cô Giang hẻm 1 trục quận Phú Nhuận,8.0,56.0,3.0,5.7,3.0,1.0,76.0,2.0,20.0
816,BÁN GẤP NHÀ CŨ NÁT CẤP 4 ĐOÀN VĂN BƠ Q4 44M2 GIÁ 1T350,8.0,44.0,3.0,1.35,3.0,1.0,555.0,8.0,11.0
817,"Bán Nhà Đúc 1 Lửng 2 Lầu 1 Sân Thượng DT: 4m x 11m Giá 5,3 Tỷ",8.0,44.0,5.0,5.3,4.0,3.0,206.0,10.0,19.0
818,"Nhà chính chủ giá cực tốt tại đường Nguyên Hồng, P11, Q. Bình Thạnh giá chỉ có 7,5 tỷ",8.0,56.0,5.0,7.5,4.0,3.0,234.0,4.0,17.0
819,BÁN GẤP NHÀ CŨ CẤP 4 ÂU DƯƠNG LÂN Q8 52M2 GIÁ 1T490,8.0,52.0,5.0,1.49,4.0,3.0,545.0,22.0,15.0
820,BÁN GẤP NHÀ CŨ CẤP 4 DƯƠNG BÁ TRẠC Q8 46M2 GIÁ 1T280,8.0,46.0,5.0,1.28,4.0,3.0,97.0,12.0,15.0
821,BÁN GẤP NHÀ CŨ CẤP 4 NGUYỄN TRÃI Q5 44M2 GIÁ  1T280,8.0,44.0,5.0,1.28,4.0,3.0,285.0,25.0,12.0
822,"Bán nhà cũ đường Đỗ Xuân Hợp, Giá mềm",8.0,46.0,5.0,2.1,2.0,3.0,580.0,76.0,16.0
823,BÁN GẤP NHÀ CẤP 4 CŨ NGUYỄN THỊ THẬP Q7 40M2 GIÁ 1T270,8.0,40.0,5.0,1.27,2.0,3.0,279.0,92.0,14.0
824,CHUYÊN CÔNG TAC BÁN GẤP NHÀ ĐƯỜNG 3 PHƯỚC BÌNH - 6.3 TỶ,8.0,88.0,14.0,6.3,2.0,1.0,530.0,73.0,16.0
825,"Bán nhà cấp 4, còn mới đường 359, phường Phước Long B - Quận 9.",8.0,72.0,4.0,3.6,2.0,1.0,534.0,76.0,16.0
826,BÁN GẤP NHÀ CŨ CẤP 4 TRẦN HƯNG ĐẠO Q5 40M2 GIÁ 1T430,8.0,40.0,4.0,1.43,2.0,1.0,428.0,22.0,12.0
827,BÁN GẤP NHÀ CẤP 4 LÊ QUANG SUNG Q6 45M2 GIÁ 1T455,8.0,45.0,4.0,1.455,2.0,1.0,181.0,26.0,13.0
828,Bán nhà hẻm 6m thông Đào Tông Nguyên DT 4.2x13m 1 lầu giá 3.35 tỷ,8.0,53.0,6.0,3.35,2.0,1.0,560.0,114.0,4.0
829,"Thu hồi vốn gấp nên bán nhanh nhà đường hẻm lớn Lữ Giá, p15- Q11, 42m2 - giá 1 tỷ 530tr, S",8.0,42.0,4.0,1.53,2.0,1.0,221.0,8.0,7.0
830,BÁN GẤP NHÀ CŨ CẤP 4 BÀ HOM Q6 45M2 GIÁ 1T250,8.0,45.0,4.0,1.25,2.0,1.0,28.0,22.0,13.0
831,"Nhà mặt tiền đường số 37, gần Lotte Mart Quận 7. 4.8x22, 3 lầu, giá 10.4 tỷ",8.0,256.0,12.0,10.4,4.0,3.0,380.0,93.0,14.0
832,"Bán nhà hẻm 6m Lý Phục Man, Quận 7. DT 4×12.5m, 1 trệt 2 lầu 3PN kiên cố. Giá 5.8 tỷ",8.0,50.0,6.0,5.8,3.0,3.0,213.0,37.0,14.0
833,"Nhà mới đường nhựa 9m Hoàng Quốc Việt, DT 51m2 4 tầng tặng nội thất. Giá 6.3 tỷ",8.0,51.0,9.0,6.3,4.0,3.0,120.0,68.0,14.0
834,BÁN GẤP NHÀ CŨ CẤP 4 HUỲNH TẤN PHÁT Q7 42M2 GIÁ 1T340,8.0,42.0,9.0,1.34,4.0,3.0,130.0,68.0,14.0
835,"Cần sang gấp nhà Nguyễn Tiểu La, Q10- p8, 1 trệt 1 lầu, 43m2 - giá 1 tỷ 540tr, SHR- XDTD",8.0,43.0,3.5,1.54,2.0,1.0,282.0,12.0,6.0
836,BÁN GẤP NHÀ CŨ CẤP 4 NGUYỄN DUY Q8 40M2 GIÁ 1T190,8.0,40.0,3.5,1.19,2.0,1.0,245.0,3.0,15.0
837,"Định cư nước ngoài nên cần bán gấp nhà hẻm Trần Nhân Tôn, Q10- p2,  43m2 giá 1tỷ470, SHR",8.0,43.0,4.0,1.47,2.0,1.0,434.0,12.0,6.0
838,"Bán gấp nhà hẻm Đường số 9, P. 9, Q. Gò Vấp, 45m2, 1 tỷ 650 triệu, SHR",8.0,45.0,4.0,1.65,2.0,1.0,388.0,26.0,19.0
839,"CẦN BÁN GẤP CĂN NHÀ NÁT ĐƯỜNG HÒA HƯNG,P12,Q10,SHR, 1 TỶ 61, 42M2,HẺM XE HƠI",8.0,42.0,3.5,1.62,1.0,1.0,137.0,5.0,6.0
840,"Bán nhanh giá tốt xe hơi vào nhà đường Phạm Văn Đồng, Phường 3, Gò Vấp 80m2, 4T, 6.7 tỷ",8.0,80.0,5.0,6.7,4.0,4.0,352.0,20.0,19.0
841,"Cần bán nhà diện tích 48m2 hẻm thông thoáng Đường Tôn Đản, P. 15, Q. 4 giá 1,28 tỷ",8.0,48.0,5.0,1.28,2.0,1.0,480.0,8.0,11.0
842,"Bán nhà mới đẹp HXH đường Thái Phiên, P. 2, Q. 11, DT 4x13m,1 trệt,1 lầu.",8.0,52.0,5.0,1.6,3.0,1.0,396.0,12.0,7.0
843,"Sở hữu căn nhà đẹp tại khu CC 26, Lê đức Thọ, P.17, Gò vấp, 4x16, giá chỉ có 7,9 tỷ",8.0,60.0,6.0,7.9,4.0,3.0,206.0,10.0,19.0
844,Bán nhà nát hẻm 7m Bờ Bao Tân Thắng Tân Phú 8x16m giá 15 tỷ TL (đối diện AEON),8.0,128.0,6.0,15.0,4.0,3.0,58.0,78.0,23.0
845,"Bán nhà mới 100% dọn ở ngay DT 80m2 HXH 463B Cách Mạng Tháng 8,Q10.Giá 5,5 Tỷ TL Tặng NT",8.0,80.0,6.0,5.5,3.0,3.0,69.0,6.0,6.0
846,"Nhà 4,5 Tấm Nguyễn Đình Chiểu, Q1 ngay Đài THHCM. DT: 4.5x14 Giá 26Tỷ.Đang cho Thuê CHDV",8.0,63.0,12.0,26.0,8.0,4.0,309.0,106.0,5.0
847,"Chính chủ cần bán nhà đường Bà Hom phường 13 Quận 6 giá 1 tỷ 370 triệu , DT 65m2",8.0,65.0,5.0,1.37,3.0,1.0,28.0,6.0,13.0
848,"Vợ chồng ly hôn bán gấp nhà nát đường Dân Chủ, Thủ Đức, 56m2,Giá chỉ 1 tỷ 320tr,SHR",8.0,56.0,5.0,1.32,2.0,1.0,96.0,60.0,21.0
849,"Bán gấp nhà Nguyễn Thái Sơn Gò Vấp, 60m2, 2 tầng, ngay công viên Gia Định, giá 4tỷx.",8.0,60.0,3.0,4.25,3.0,2.0,274.0,20.0,19.0
850,"Nhà mới Hoàng Hoa Thám, Phú Nhuận, 4 tấm, 50m2, 6.xtỷ. Kinh doanh đỉnh.",8.0,50.0,5.0,6.9,4.0,4.0,118.0,22.0,20.0
851,"Nhà Nguyễn Kiệm, ngay công viên Gia Định, 4x10m, nở hậu tài lộc, 3tỷx",8.0,40.0,4.0,3.1,3.0,2.0,260.0,20.0,19.0
852,"Kẹt tiền bán nhanh nhà hẻm lớn đường Bắc Hải, p15- Q10, 41m2 - giá 1 tỷ 470tr, SHR",8.0,41.0,4.0,1.47,2.0,1.0,55.0,8.0,6.0
853,"Cần bán gấp căn nhà nát đường Nguyễn Thiện Thuật, q3, 56m2 sổ sẵn, xây tự do,1 tỷ350 triệu",8.0,56.0,5.0,1.35,2.0,1.0,270.0,12.0,10.0
854,"Bán nhà Góc 2 mặt tiền Lê Hồng Phong - An Dương Vương, phường 4 ,Quận 5 5.5x20m, giá 28 tỷ",8.0,120.0,14.0,28.0,8.0,2.0,173.0,21.0,12.0
855,"Cần sang gấp nhà Hòa Hảo , Q10- p5, 1 trệt 1 lầu, 43m2 - giá 1 tỷ 540tr, SHR- XDTD",8.0,43.0,4.0,1.54,2.0,1.0,138.0,22.0,6.0
856,"Đang cần bán gấp nhà hẻm lớn đường Tạ Quang Bửu, P4 - Q8, 46m2 - giá 1 tỷ 490tr",8.0,46.0,4.0,1.49,2.0,1.0,484.0,21.0,15.0
857,"⚡HOT⚡ ☎ bán Nhà ☎ ( như hình - SHR 100% ) đã có sổ ,công chứng trong ngày, mời xem nhà ☎",8.0,220.0,8.0,3.5,6.0,3.0,323.0,70.0,23.0
858,"Bán nhà MT Cư Xá Lữ Gia, Quận 11. DT: 6x10m, 3 lầu, 9.1 tỷ TL ( Hưng 0913 547 198)",8.0,60.0,12.0,9.1,3.0,3.0,79.0,8.0,7.0
859,"Bán nhà MT đường Bình thới, quận 11, DT 4.5 x15m, Nở hậu, 2 lầu, giá 12.8 tỷ TL",8.0,65.0,16.0,12.8,3.0,2.0,40.0,3.0,7.0
860,"Bán nhà HXH Bình Thới Đối diện uy ban Quận 11,dt:4x16m, giá 7 tỷ TL(0913 547 198)",8.0,64.0,6.0,7.0,2.0,1.0,40.0,3.0,7.0
861,"Bán nhà Hẻm Xe Hơi gần Lê Đại Hành, Quận 11, DT: 4,6x20m, giá 8 tỷ",8.0,90.0,10.0,8.0,4.0,1.0,205.0,4.0,7.0
862,NGOẠI GIAO CHO CHỦ TỊCH….. GIÁ KHÔNG THỂ TỐT HƠN BIỆT THỰ VINHOMES GRAND PARK CHỈ 72TR/M2,8.0,600.0,12.0,72.0,6.0,3.0,306.0,63.0,16.0
863,Bán nhà mặt tiền đường Phùng Văn Cung  Q. Phú Nhuận diên tích đep chuẩn giá tốt,8.0,162.0,15.0,5.6,6.0,5.0,338.0,21.0,20.0
864,LỘ DIỆN BÁN GẤP 1200M2 ĐẤT MẶT TIỀN PHƯỚC THIỆN CHỈ 52TR/M2 NGAY VINHOMES GRAND PARK,8.0,1.2,6.0,52.0,6.0,3.0,341.0,64.0,16.0
865,KINH DOANH TOANG BÁN GẤP 1520M2 ĐẤT MẶT TIỀN PHƯỚC THIỆN Q9 CHỈ 55TR/M2,8.0,1.52,6.0,55.0,6.0,3.0,341.0,63.0,16.0
866,GIÁ NỘI BỘ HIẾM CHỈ 75TR/M2 BIỆT THỰ VINHOMES GRAND PARK 300M2,8.0,300.0,12.0,75.0,6.0,3.0,306.0,63.0,16.0
867,"Định cư Canada,Bán nhà cấp 4 Bạch Đằng,68m2/930tr,SHR,Gần chợ Bà Chiểu",8.0,68.0,6.0,0.93,2.0,1.0,53.0,15.0,17.0
868,Ly dị bán gấp nhà nát Ung Văn Khiêm BT 86m2/980tr gần trường tiện ở KD SHR XDTD LH chị MY,8.0,86.0,14.0,0.98,1.0,1.0,490.0,16.0,17.0
869,"Thua cá độ bóng đá,Bán gấp nhà nát lấy đất MT Vườn Chuối-Q3,64m2/1Ty,SHR,Gần chợ",8.0,64.0,10.0,1.0,1.0,1.0,506.0,21.0,10.0
870,"Vỡ nợ bán gấp nhà nát lấy đất Huỳnh Tấn Phát, Q7 70m2 880tr tiện ở, KD cho thuê- LH chị MY",8.0,70.0,14.0,0.88,1.0,1.0,130.0,96.0,14.0
871,"Cần tiền đầu tư,Bán gấp nhà cấp 4 Vĩnh Hội-Q4,68m2/930tr,SHR,Gần UBND Quận 4",8.0,68.0,6.0,0.93,1.0,1.0,501.0,21.0,11.0
872,"Thiếu nợ ngân hàng,bán gấp nhà nát HXH Tô Hiến Thành-Q10,60m2/1Ty4,SHR,Gần BigC",8.0,60.0,5.0,1.4,1.0,1.0,476.0,8.0,6.0
873,"Chuyển vào trung tâm ở, Bán nhà cấp 4 Nguyễn Thị Thập 80m2/950tr,SHR,Sát Lotte Mart Quận 7",8.0,80.0,6.0,0.96,2.0,1.0,279.0,93.0,14.0
874,Bán nhà nát MT đường số 2 KDC Nam Hùng Vương Bình Tân 282m2 giá 13 tỷ TL,8.0,282.0,6.0,13.0,2.0,1.0,371.0,28.0,18.0
875,"Cần tiền trả nợ,Bán gấp nát đường Số 19-TĐ,67m2/930tr,SHR,Sát Gigamall Thủ Đức",8.0,65.0,6.0,0.93,2.0,1.0,369.0,50.0,21.0
876,Bán nhà MT Đường số 2 Tân Phú 4x20m đúc 3.5 tấm giá 10.5 tỷ TL (gần Nguyễn Văn Tố),8.0,80.0,12.0,10.5,4.0,2.0,371.0,97.0,23.0
877,"Chuyển công tác,Bán nhà cấp 4 2pn Đặng Văn Bi-TĐ,68m2/940tr,SHR,Gần ĐH Kiến Trúc",8.0,68.0,8.0,0.94,2.0,1.0,570.0,38.0,21.0
878,"Cho con du học, bán nhà nát Lê Văn Việt-Q9,70m2/930tr,SHR,Gần Bệnh Viện",8.0,70.0,8.0,0.93,2.0,1.0,202.0,52.0,16.0
879,"Định cư nước ngoài,Bán dãy trọ 8 phòng Đỗ Xuân Hợp-Q9,75m2/970tr,SHR,Gần Chợ",8.0,75.0,6.0,0.97,8.0,2.0,580.0,73.0,16.0
880,Định cư nước ngoài bán gấp nhà 80m2 Xô Viết Nghệ Tĩnh Q Bình Thạnh,8.0,80.0,15.0,0.97,2.0,1.0,513.0,14.0,17.0
881,Bán nhà MTKD Tân Hương Tân Phú 4x17m đúc lửng 2 lầu giá 12.5 tỷ TL (gần Bình Long),8.0,68.0,20.0,12.5,4.0,3.0,461.0,94.0,23.0
882,Bán nhà hẻm 10m Bờ Bao Tân Thắng Tân Phú 4x16m đúc lửng 3 lầu giá 9.2 tỷ TL,8.0,64.0,10.0,9.2,5.0,3.0,58.0,78.0,23.0
883,"Cá độ thua bán gấp nhà Thảo Điền,80m2/950tr, gần chợ,UBND,SHR",8.0,80.0,15.0,0.95,2.0,1.0,405.0,40.0,9.0
884,"Cá độ thua bán gấp nhà Trần Não,80m2/950tr, gần chợ,UBND,SHR",8.0,80.0,20.0,0.94,2.0,1.0,435.0,32.0,9.0
885,"Thua chứng khoán bán gấp nhà nát 60m2/850tr Đường D2, Quận Bình Thạnh,",8.0,60.0,17.0,0.85,2.0,1.0,89.0,16.0,17.0
886,"Càn tiền chửa bệnh lớn tuổi,bán gấp nhà nát Nguyễn Duy Trinh,Q2,69m2/940tr,SHR,Gần UBND",8.0,69.0,8.0,0.94,2.0,1.0,249.0,39.0,9.0
887,"Nhà mặt tiền đường 14 phước bình, DT 97m cấp 4 giá rẻ",8.0,97.0,12.0,4.65,2.0,1.0,368.0,73.0,16.0
888,Định cư nước ngoài bán gấp nhà Ung Văn Khiêm 70m2/900tr Q Bình Thạnh,8.0,70.0,20.0,0.9,2.0,1.0,490.0,15.0,17.0
889,Nhà mặt tiền đại lộ 3 phước bình diện tích 86m khu tiện ích,8.0,86.0,20.0,7.1,2.0,1.0,585.0,73.0,16.0
890,": Vỡ nợ bán gấp nhà nát Trần Văn Ơn,75m2/930tr, gần chợ, UBND, SHR",8.0,75.0,12.0,0.93,2.0,1.0,450.0,95.0,23.0
891,"Cần tiền kinh doanh bán gấp nhà nát Điện Biên Phủ 70m2/860tr, Quận Bình Thạnh, SHR",8.0,70.0,15.0,0.86,2.0,1.0,551.0,14.0,17.0
892,"Ly hôn chồng bán gấp nhà Thủ Đức,90m2/960tr, gần UBND, siêu thị,SHR",8.0,90.0,15.0,0.96,2.0,1.0,369.0,50.0,21.0
893,"Ly hôn chồng bán gấp nhà Thành Thái Q10 ,70m2/960tr, gần UBND, siêu thị,SHR",8.0,70.0,10.0,0.96,2.0,1.0,395.0,8.0,6.0
894,Cần bán gấp nhà sau chợ Hóc Môn - 850 triệu/sổ hồng công chứng,8.0,83.0,13.0,0.85,2.0,1.0,406.0,130.0,3.0
895,"Bán nhà làm văn phòng đường Nguyễn Ảnh Thủ-HM, dt 62m2 giá 1 tỷ 950tr",8.0,72.0,10.0,1.95,2.0,2.0,308.0,116.0,3.0
896,"NHÀ MỚI XÂY 5 x 22m2 GẦN CHỢ, KCN LỚN. THUẬN TIỆN KINH DOANH, BUÔN BÁN, CHO THUÊ. SHR",8.0,80.0,10.0,0.98,3.0,2.0,99.0,134.0,0.0
897,"Cần tiền đi XKLĐ, bán gấp căn nhà đường Lê Lợi-HM, dt 81,6m2 giá 1,79 tỷ.",8.0,82.0,12.0,1.79,2.0,2.0,178.0,113.0,3.0
898,"Nhà quận 12 cho khách đầu tư,72m2 đang cho thuê 7 triệu/tháng,giá 1 tỷ 250tr",8.0,72.0,5.0,1.25,2.0,1.0,412.0,85.0,8.0
899,"Chủ cần bán gấp căn nhà cấp 4 gác lửng, diện tích nhà ngang 4m dài 13m, giá bán 1.650 tỷ,",8.0,52.0,5.0,1.65,2.0,1.0,467.0,98.0,8.0
900,"Cần bán gấp nhà cấp 4 gác lửng, ngang 4m dài 12m, giá bán 1.5 tỷ, Sổ Hồng Riêng chính chủ,",8.0,48.0,5.0,1.5,2.0,1.0,561.0,88.0,8.0
901,"Chính chủ gửi bán gấp căn nhà 1 trệt 1 lầu, diện tích nhà ngang 4.5m dài 12m, giá bán 1.7",8.0,54.0,4.0,1.7,2.0,1.0,107.0,129.0,3.0
902,"Cần bán gấp nhà cấp 4, ngang 4m dài 20m, giá bán 1.45 tỷ, Sổ Riêng chính chủ, hẻm xe hơi v",8.0,80.0,4.0,1.45,2.0,1.0,408.0,84.0,8.0
903,"Chủ cần bán gấp căn nhà cấp 4 đúc lửng, diện tích nhà ngang 4m dài 13m, giá bán 1.680 tỷ,",8.0,52.0,4.0,1.68,2.0,1.0,111.0,53.0,8.0
904,"Nhà Hóc Môn cho thuê cần bán 4x17m2,sổ riêng,gần trung tâm thị trấn,giá 1 tỷ 270tr",8.0,68.0,5.0,1.27,2.0,1.0,188.0,113.0,3.0
905,"bán nhà ngay trung tâm gần bệnh viện quận 12,sổ riêng,72m2,giá 1 tỷ 200tr",8.0,72.0,4.0,1.2,3.0,1.0,101.0,88.0,8.0
906,"Bán nhanh nhà đep khu VIP Tân Bình, 5 tầng - 68m2, xe hơi đậu trong nhà. Giá 14 tỷ",7.0,68.0,7.0,14.0,3.0,5.0,122.0,21.0,22.0
907,Bán nhà 2 Mặt Tiền đường Vĩnh Hội P4 Q4. Thu nhập 50tr/tháng,7.0,85.0,15.0,20.0,4.0,3.0,501.0,21.0,11.0
908,Bán nhà HXH đường Đoàn Như Hài P12 Q4,7.0,57.0,5.0,12.5,1.0,1.0,553.0,5.0,11.0
909,Đinh Cư Cần Bán Nhà HXH Nguyễn Trọng Tuyển 1 trệt 3 lầu 5PN+WC Gía 5.95 tỷ.,7.0,50.0,4.0,5.95,5.0,4.0,287.0,2.0,22.0
910,CẦN BÁN GẤP NHÀ PHƯỜNG 8 QUẬN TÂN BÌNH DT:56M2 GIÁ CHỈ 4.1 TỶ CÒN TL.,7.0,56.0,3.0,4.1,3.0,2.0,394.0,25.0,22.0
911,Bán nhà HXH đường Tôn Thất Thuyết,7.0,58.0,3.0,6.5,1.0,2.0,478.0,20.0,11.0
912,Bán nhà Mặt Tiền Lê Quốc Hưng P12 Q4. Thu nhập 50tr/tháng,7.0,68.0,15.0,22.0,3.0,3.0,184.0,5.0,11.0
913,"Mặt tiền Thống Nhất, P16, Gò Vấp, 4.7m x 18m, 1 lầu, đct 22 tr/tháng, giá 11 tỷ TL",7.0,85.0,40.0,11.0,3.0,1.0,407.0,9.0,19.0
914,"Bán gấp MT Lê Đức Thọ, P6, Gò Vấp, DT: 5.3 x 25m, TẦNG TRỆT đang cho thuê 40triệu/tháng",7.0,120.0,30.0,13.8,4.0,2.0,206.0,23.0,19.0
915,"Mức giá hợp lý cho anh chị em đầu tư nhà 3 tầng,90m2, 1,87 tỷ",7.0,90.0,6.0,1.87,4.0,2.0,165.0,35.0,18.0
916,"Nhà vị trí đẹp nhất chợ Bình Thành, 120M2, 1 trệt 2 lầu, 2.15 tỷ",7.0,120.0,10.0,2.15,4.0,2.0,280.0,35.0,18.0
917,"Nhà vị trí đẹp nhất chợ Bình Thành, 120M2, 1 trệt 2 lầu, 2.15 tỷ",7.0,120.0,10.0,2.15,4.0,2.0,149.0,35.0,18.0
918,"Nhà vị trí đẹp nhất chợ Bình Thành, 120M2, 1 trệt 2 lầu, 2.15 tỷ",7.0,120.0,10.0,2.15,4.0,2.0,192.0,33.0,18.0
