2029,"Bánh nhanh trong tháng 3. Nhà ngay Giga Mall Phạm Văn Đồng, Hiệp Bình Chánh, Thủ Đức",9.0,60.0,7.0,7.0,4.0,3.0,376.0,51.0,21.0
2030,"CHÍNH CHỦ BÁN NHÀ 1 TRỆT 2 LẦU, 237M2 GIÁ CHỈ 5 TỶ 5, NHÀ MỚI XÂY, SÂN CỰC RỘNG, XEM LÀ MÊ",9.0,237.0,8.0,5.32,4.0,2.0,366.0,51.0,21.0
2031,"Bán lỗ vốn căn nhà ngay Phạm Văn Đồng, đường ô tô, 136m2 1 trệt 2 lầu, SHR LH: 077661338*",9.0,136.0,7.0,6.8,5.0,2.0,16.0,50.0,21.0
2032,"Mặt tiền kinh doanh Kha Vạn Cân, Thủ Đức sát cầu Bình Lợi, đường 14m, sân cực rộng",9.0,54.0,20.0,8.0,5.0,4.0,154.0,50.0,21.0
2033,"Nhà 2 lầu mới xây xong , sổ riêng hoàn công đủ , ngay đường số 1 kế bên Vạn Phúc City",9.0,52.0,5.0,4.6,4.0,2.0,516.0,51.0,21.0
2034,"NHÀ MỚI 1T2L NGAY ĐƯỜNG SỐ 16 PHẠM VĂN ĐỒNG, CẠNH SÔNG SG THOÁNG MÁT - 5 TỶ 823 TR SHR",9.0,52.0,5.0,5.82,4.0,2.0,524.0,50.0,21.0
2035,NHÀ 2 LẦU ( 5.5 x 14 ) NGAY CHÂN CẦU Ô DẦU - HIỆP BÌNH CHÁNH - CÁCH MT QL13 CHỈ 20M,9.0,79.0,6.0,5.2,4.0,2.0,522.0,50.0,21.0
2036,Nhà sổ hồng riêng mới 100% Ngã 3 Quốc lộ 13 – Hiệp Bình Giá chỉ 4.2 tỷ/53m2 Có NH bảo lãnh,9.0,135.0,7.0,4.3,4.0,2.0,388.0,51.0,21.0
2037,Nhà mặt phố 94m2 ngay chợ Hiệp Bình Hiệp Bình Chánh TĐ SHR,9.0,94.0,12.0,133.0,4.0,3.0,381.0,50.0,21.0
2038,Nhà Phố Thương Mại Mt Hồ Văn Tư Chợ Thủ Đức Shr + Hoàn Công,9.0,68.0,6.0,6.0,4.0,2.0,150.0,87.0,21.0
2039,"Hạ Giá Bán Thu Hồi Vốn Căn Nhà Mới Xây, 3 Tầng, 68m2, SHR. Gần Nhà Thờ Fatima Bình Triệu",9.0,68.0,6.0,7.3,4.0,2.0,518.0,50.0,21.0
2040,Nhà 1 trệt 3 lầu. 5 x 16.4m 6.8 tỷ sổ hồng riêng Ngay Coopmart Bình Triệu . Sân Đậu Ô tô,9.0,80.0,6.0,85.0,4.0,3.0,387.0,50.0,21.0
2041,NGỘP NGÂN HÀNG CẦN RA HÀNG GẤP NHÀ PHỐ MỚI 100% LH: 077661338** gặp Tiên,9.0,80.0,12.0,143.0,5.0,4.0,307.0,17.0,17.0
2042,"Làm ăn thua lỗ, chính chủ cần bán gấp nhà 1T2L 68m2 Đường số 10 HBP",9.0,68.0,8.0,4.8,4.0,2.0,366.0,51.0,21.0
2043,"MỞ BÁN 30 CĂN NHÀ PHỐ KHU VỰC BÌNH THẠNH GIÁ RẺ,SANG TÊN VÀO Ở LIỀN,BIDV HỖ TRỢ VAY",9.0,180.0,4.0,5.9,4.0,3.0,548.0,17.0,17.0
2044,"Nhà trong khu biệt thự Bình Lợi , 1 trệt 4 lầu 6 phòng ngủ , vị trí siêu đẹp",9.0,62.0,7.0,9.1,6.0,4.0,36.0,6.0,17.0
2045,CẦN TIỀN NÊN BÁN GẤP NHÀ 2 LẦU 68M2 NGAY CHỢ HIỆP BÌNH- ĐƯỜNG LỚN HXH SHR,9.0,68.0,7.0,109.0,4.0,2.0,16.0,50.0,21.0
2046,MỞ BÁN 30 CĂN NHÀ PHỐ TRUNG TÂM QUẬN THỦ ĐỨC-MUA NHÀ MÙA COVID GIÁ GIẢM SẬP SÀN CHỈ TỪ 5TỶ,9.0,65.0,5.0,5.0,4.0,3.0,18.0,50.0,21.0
2047,"Bán đất hẻm 400 ngay ngã 4 Hàng Xanh,cách XVNT 20m",9.0,38.0,5.0,3.7,4.0,3.0,513.0,16.0,17.0
2048,"Kèo thơm! nhà 1 trệt 2 lầu 72m2 , tặng thêm 170m2 đất, giá chỉ 5 tỷ xx, SHR hoàn công đầy",9.0,237.0,7.0,5.0,4.0,2.0,366.0,51.0,21.0
2049,"Nhà bán hẻm 351 Đường số 3,Hiệp Bình Phước, công viên nội khu, đường ô tô tránh nhau 8m",9.0,160.0,8.0,6.6,4.0,3.0,376.0,51.0,21.0
2050,"BÁN NHÀ 4 LẦU, ĐƯỜNG CHU VĂN AN, SHR HẺM XE HƠI 7 CHỔ",9.0,60.0,5.0,6.4,5.0,4.0,67.0,17.0,17.0
2051,"Bán nhà nguyên căn DTSD 160m2, hẻm xe hơi,SHR,giá chỉ 4 tỷ/căn",9.0,53.0,6.0,4.275,4.0,2.0,12.0,51.0,21.0
2052,"Vỡ nợ mùa dịch, hạ giá bán lỗ nhà 160m2 1 trệt 2 lầu ở HBP, Q TĐ",9.0,135.0,6.0,4.3,4.0,2.0,388.0,51.0,21.0
2053,"Bán nhà Thủ Đức, đường xe tải 8 mét, nhà 2 lầu - giá siêu hot 5,1 tỷ",9.0,56.0,5.0,5.1,4.0,2.0,12.0,51.0,21.0
2054,"Kẹt tiền cần bán gấp nhà mặt tiền hẻm 107 đường 38,ngay chợ Hiệp Bình,",9.0,134.0,7.0,7.3,5.0,2.0,381.0,50.0,21.0
2055,"Bán gấp nhà 3 lầu, 5.9 tỷ sổ hồng riêng tại Đinh Bộ Lĩnh - Bến Xe Miền Đông!",9.0,46.0,4.0,5.96,4.0,3.0,548.0,17.0,17.0
2056,Tôi là bác sĩ cần sang gấp căn nhà khu sân bay măt tiền Hát Giang P2 Tân Bình DT 5mx24m,9.0,115.0,20.0,15.7,3.0,2.0,135.0,12.0,22.0
2057,Bán nhà hẻm 8m đường Nguyễn Bặc 6mx25m kết cấu 3 lầu vào ở kinh doanh ngay hoặc cho thuê,9.0,150.0,8.0,14.5,4.0,3.0,237.0,12.0,22.0
2058,Vỡ nợ cần bán gấp nhà Trần Não 60m2 1 tỷ 4 có sổ hồng riêng,9.0,60.0,5.0,1.4,3.0,1.0,435.0,32.0,9.0
2059,Cần bán gấp nhà để trả nợ ngân hàng,9.0,66.0,5.0,1.24,3.0,1.0,570.0,87.0,21.0
2060,"Cần bán gấp căn nhà Trần Não , q2 , 60m2 , 1 tỷ 3 , shr , xdtd",9.0,60.0,5.0,1.3,3.0,1.0,435.0,32.0,9.0
2061,"Nợ do đợt dịch COVID-19 cần bán nhà ở Trần Não , Quajan2 , 48m2 , 1 tỷ 120",9.0,48.0,5.0,1.12,3.0,1.0,435.0,32.0,9.0
2062,"Cần bán nhà Đỗ Xuân Hợp , Quận 9 , 56m2 , 1 tỷ 320 , shr , xdtd",9.0,56.0,5.0,1.32,3.0,1.0,580.0,76.0,16.0
2063,"Cần bán nhà ở Dương Bá Trạc , q8 , 56m2 , 1 tỷ 320 , shr , xdtd",9.0,56.0,5.0,13.2,3.0,1.0,97.0,2.0,15.0
2064,"Trả nợ cho cha , cần bán nhà ở Đỗ Xuân Hợp, Q9 , 52m2 , 1 tỷ 230",9.0,52.0,5.0,1.23,3.0,1.0,580.0,105.0,16.0
2065,"Ly hôn chia tài sản cần bán nhà Trần Não , Quận 2 , 48m2 , 1 tỷ 210",9.0,48.0,5.0,1.32,3.0,1.0,435.0,32.0,9.0
2066,"Ly hôn chia tài sản cần bán nhà Trần Não , Quận 2 , 52m2 , 1 tỷ 320",9.0,52.0,5.0,1.32,3.0,1.0,435.0,32.0,9.0
2067,"Cần bán gấp nhà ở Nguyễn Thị Thập , Quận 7 , 52m2 , 1 tỷ 120",9.0,52.0,5.0,1.12,3.0,1.0,279.0,93.0,14.0
2068,"Định cư nước ngoài cần bán gấp căn nha ở Mai Văn Vĩnh ,Q7 , 48m2 , 1 tỷ 110 , shr , xdtd",9.0,48.0,5.0,1.1,3.0,1.0,225.0,93.0,14.0
2069,"Thiếu nợ sau Covid-19 cần bán gấp căn nhà ở Nguyễn Thị Định , Q2 , 52m2 , 1 tỷ 240",9.0,52.0,5.0,1.24,3.0,1.0,281.0,46.0,9.0
2070,"Về Bắc sinh sống cần bán nhà ở Huỳnh Tấn Phát , Q7 , 61m2 , 1 tỷ 270",9.0,61.0,5.0,1.27,3.0,1.0,130.0,69.0,14.0
2071,"Định cư nước ngoài nên cần bán căn nhà ở Trần Não , Quận 2 , 52m2 , 1 tỷ 210",9.0,52.0,5.0,1.21,3.0,1.0,435.0,32.0,9.0
2072,"Thua lỗ chứng khoán , cần bán gấp nhà Mai Văn Vĩnh, Q7 , 1 tỷ 160 , 48m2",9.0,48.0,5.0,1.16,3.0,1.0,225.0,93.0,14.0
2073,"Nhà Đỗ Xuân Hợp , Q9 , 53m2 , 1 tỷ 220 , shr , xdtd cần bán gấp",9.0,53.0,5.0,1.22,2.0,1.0,580.0,76.0,16.0
2074,"Nhà nát quận 9, Đỗ Xuân Hợp , 980tr , 65m2 , shr , xdtd",9.0,65.0,5.0,0.98,2.0,1.0,580.0,76.0,16.0
2075,"Nhà cấp 4 cần bán gấp ở đường Lương Định Của , Quận 2 , 1 tỷ 230",9.0,57.0,5.0,1.23,2.0,1.0,435.0,32.0,9.0
2076,"Kinh doanh thua lỗ cần bán căn nhà ở Nguyễn Thị Định , Quận 2 , 53m2 , 1 tỷ 210",9.0,53.0,5.0,1.21,3.0,1.0,281.0,46.0,9.0
2077,"Vỡ nợ cần bán gấp nhà ở Tô Ngọc Vân , Thủ Đức , 59m2 , 1 tỷ 220",9.0,59.0,5.0,1.22,3.0,1.0,477.0,58.0,21.0
2078,"Kinh doanh thua lỗ cần bán gấp căn nhà ở Đặng Văn Bi , Thủ Đức , 54m2 , 1 tỷ 250",9.0,54.0,5.0,1.25,3.0,1.0,570.0,38.0,21.0
2079,"Xoay vốn cần bán gấp nhà ở Đỗ Xuân Hợp , Q9 , 61m2 , 1 tỷ 310",9.0,61.0,5.0,1.31,3.0,1.0,580.0,76.0,16.0
2080,"Định cư nước ngoài cần bán gấp nhà ở Lương Định Của , Q9 , 52m2 , 1 tỷ 140",9.0,52.0,5.0,1.14,3.0,1.0,219.0,32.0,9.0
2081,"Vỡ nợ sau đợt dịch COVID-19 cần bán gấp nhà ở Tô Ngọc Vân , Thủ Đức , 58m2 , 1 tỷ 230",9.0,58.0,5.0,1.23,3.0,1.0,477.0,58.0,21.0
2082,"Đầu tư chứng khoán thua lỗ bán nhà ở Ung Văn Khiêm , Bình Thạnh , 60m2 , 1 tỷ 260",9.0,60.0,5.0,1.26,3.0,1.0,490.0,16.0,17.0
2083,"Ly hôn chia tài sản cần bán nhà ở Ung Văn Khiêm , Bình Thạnh , 53m2 , 1 tỷ 180",9.0,53.0,5.0,1.18,3.0,1.0,490.0,16.0,17.0
2084,"Nợ ngân hàng cần bán gấp nhà ở Phú Châu , Thủ Đức , 52m2 , 1 tỷ 230",9.0,52.0,5.0,1.23,3.0,1.0,17.0,79.0,21.0
2085,"Cần bán gấp căn nhà ở Lương Định Của , Quận 2 , 58m2 , 1 tỷ 270 , shr , xdtd",9.0,58.0,5.0,1.27,3.0,1.0,219.0,32.0,9.0
2086,"Vì công việc cần về Bắc nên bán nhà ở Lê Văn Việt , Q9 , 52m2 , 1 tỷ 210",9.0,48.0,5.0,1.21,3.0,1.0,202.0,104.0,16.0
2087,"Ly hôn chia tài sản cần bán nhà ở Phan Đăng Lưu , Bình Thạnh , 53m2 , 1 tỷ 220",9.0,53.0,5.0,1.22,3.0,1.0,336.0,20.0,17.0
2088,"Bán gấp căn nhà ở Hoàng Hoa Thám , Bình Thạnh , 51m2 , 1 tỷ 210",9.0,51.0,5.0,1.21,3.0,1.0,118.0,24.0,17.0
2089,"Bán nhà cho ba mẹ lấy tiền về quê dưỡng già , Ung Văn Khiêm , Bình Thạnh , 57m2 , 1 tỷ 240",9.0,57.0,5.0,1.24,3.0,1.0,490.0,16.0,17.0
2090,"Cần bán gấp căn nhà ở Đỗ Xuân Hợp , Quận 9 , 48m2 ,1 tỷ 170",9.0,48.0,5.0,1.17,3.0,1.0,580.0,76.0,16.0
2091,"Đầu tư chứng khoán thua lỗ cần bán nhà ở Nguyễn Thị Định , Q2 , 57m2 , 1 tỷ 270",9.0,57.0,5.0,1.27,3.0,1.0,281.0,39.0,9.0
2092,"Kinh doanh thua lỗ cần bán nhà ở Tô Ngọc Vân , Thủ Đức , 52m2 , 1 tỷ 210",9.0,52.0,5.0,1.21,3.0,1.0,477.0,79.0,21.0
2093,"Bán gấp căn nhà ở Tô Ngọc Vân , Thủ Đức , 58m2 , 1 tỷ 260 , shr , xdtd",9.0,58.0,5.0,1.26,3.0,1.0,477.0,79.0,21.0
2094,"Kinh doanh thua lỗ cần bán căn nhà ở Đặng Văn Bi , Thủ Đức , 52m2 , 1 tỷ 260",9.0,52.0,5.0,1.23,3.0,1.0,570.0,38.0,21.0
2095,"Bán gấp căn nhà ở Võ Văn Ngân , Thủ Đức , 57m2 , 1 tỷ 240 , shr , xdtd",9.0,57.0,5.0,1.24,3.0,1.0,498.0,38.0,21.0
2096,"Cần bán gấp nhà ở Kha Vạn Cân , Thủ Đức , 58m2 , 1 tỷ 260 , shr , xdtd",9.0,58.0,5.0,1.26,2.0,1.0,154.0,58.0,21.0
2097,"Bán gấp căn nhà ở Đặng Văn Bi , Thủ Đức , 61m2 , 1 tỷ 270 , shr , xdtd",9.0,61.0,5.0,1.27,2.0,1.0,570.0,38.0,21.0
2098,"Kinh doanh thua lỗ cần bán gấp căn nhà ở Nguyễn Thị Định , Q2 , 53m2 , 1 tỷ 210 , shr",9.0,53.0,5.0,1.21,2.0,1.0,281.0,30.0,9.0
2099,"Về Bắc sinh sống cần bán gấp căn nhà ở Kha Vạn Cân , Thủ Đức , 53m2 , 1 tỷ 220",9.0,53.0,5.0,1.22,2.0,1.0,154.0,60.0,21.0
2100,"Định cư sang mỹ , bán gấp căn nhà ở Tô Ngọc Vân , Thủ Đức , 56m2 , 1 tỷ 240",9.0,56.0,4.5,1.24,2.0,1.0,477.0,79.0,21.0
2101,"Bán gấp căn nhà ở Kha Vạn Cân , Thủ Đúc ,55m2 , 1 tỷ 240",9.0,55.0,5.0,1.24,2.0,1.0,154.0,60.0,21.0
2102,"Cần bán gấp căn nhà ở Tô Ngọc Vân , Thủ Đức , 55m2 , 1 tỷ 250 , shr , xdtd",9.0,55.0,5.0,1.25,2.0,1.0,477.0,79.0,21.0
2103,"Kinh doanh chứng khoán thua lỗ bán nhà ở Tô Ngọc Vân , Thủ Đức , 54m2 , 1 tỷ 240 , shr",9.0,54.0,5.0,1.24,2.0,1.0,477.0,79.0,21.0
2104,"Kinh doanh thua lỗ cần bán gấp nhà ở Nguyễn Kiệm , Phú Nhuận , 57m2 , 1 tỷ 280 , shr",9.0,57.0,5.0,1.28,2.0,1.0,260.0,2.0,20.0
2105,"Bán gấp căn nhà ở Tô Ngọc Vân , Thủ Đức , 48m2 , 1 tỷ 160 , shr , xdtd",9.0,48.0,5.0,1.16,2.0,1.0,477.0,79.0,21.0
2106,"Cần bán gấp nhà ở Nguyễn Kiệm , Phú Thuận , 54m2 , 1 tỷ 240",9.0,54.0,5.0,1.24,2.0,1.0,260.0,21.0,20.0
2107,"Định cư nước ngoài cần bán gấp nhà Nguyễn Thái Sơn , Gò Vấp , 53m2 , 1 tỷ 230 , shr , xdtd",9.0,53.0,5.0,1.23,2.0,1.0,274.0,21.0,19.0
2108,"Về quê sinh sống cần bán căn nhà ở Lương Định Của , Q2 , 57m2 , 1 tỷ 270",9.0,57.0,5.0,1.27,3.0,1.0,219.0,32.0,9.0
2109,"Ba mẹ về quê dưỡng già cần bán nhà ở Lâm Văn Bền , Q7 , 52m2 , 1 tỷ 220",9.0,52.0,5.0,1.22,3.0,1.0,168.0,93.0,14.0
2110,"Cần bán gấp căn nhà ở Huỳnh Tấn Phát , Q7 , 48m2 , 1 tỷ 110",9.0,48.0,5.0,1.11,3.0,1.0,130.0,69.0,14.0
2111,"Cần bán nhà cấp 4 ở đường Dương Bá Trạc , Quận 8 , 56m2 , 1 tỷ 130 . shr , xdtd",9.0,56.0,5.0,1.16,3.0,1.0,97.0,2.0,15.0
2112,"Về Bắc sinh sống cần bán nhà ở Lâm Văn Bền , Q7 , 54m2 , 1 tỷ 250 , SHR , XDTD",9.0,54.0,5.0,1.25,3.0,1.0,168.0,93.0,14.0
2113,"Bán nhà trả nợ ngân hàng ở Lương Định Của , Quận 2 , 48m2 , 1 tỷ 230",9.0,48.0,5.0,1.23,3.0,1.0,219.0,32.0,9.0
2114,"Vỡ nợ sau đợt dịch COVID-19 cần bán nhà ở Trần Não , Quận 2 , 52m2 , 1 tỷ 2",9.0,52.0,5.0,1.2,3.0,1.0,435.0,32.0,9.0
2115,"Chuyển về Bắc sinh sống nên cần bán nhà ở Trần Não , Quận 2 , 48m2 , 1 tỷ 120",9.0,48.0,5.0,1.12,3.0,1.0,435.0,32.0,9.0
2116,"Siêu phẩm Mặt tiền Phan Xích Long, P.2, Q.Phú Nhuận, DT 8x18m, XD H 8L, Giá bán 55 tỷ",9.0,180.0,30.0,55.0,1.0,1.0,334.0,12.0,20.0
2117,"Bán nhà góc 2 MT Lê Hồng Phong, P10, Q10. DT: 7.1mx10m, thu nhập 120 triệu/th, 36 tỷ",9.0,90.0,30.0,36.0,5.0,4.0,173.0,3.0,6.0
2118,"Bán nhà mặt tiền Trà Khúc, P.2, Q.Tân Bình DT 4mx30m, trệt 2 lầu, chỉ 16.5 tỷ,",9.0,120.0,10.0,16.5,4.0,3.0,413.0,12.0,22.0
2119,"Bán mặt tiền Nguyễn Trọng Tuyển, P.1, Q.Tân Bình, DT: 8.8m x 23m, 42 tỷ",9.0,200.0,10.0,42.0,1.0,1.0,287.0,2.0,22.0
2120,"Bán nhà mặt tiền Đồng Nai - Trường Sơn, P.2, Q.Tân Bình, DT 4,5m x 18m, 3 lầu HĐT 40tr",9.0,80.0,12.0,15.0,5.0,3.0,573.0,12.0,22.0
2121,"Bán nhà mặt tiền Lê Duy Nhuận, P.12, Q.Tân Bình, DT 8.6m x 13m, 3 lầu, 15 phòng, chỉ 19 tỷ",9.0,711.0,10.0,19.0,18.0,4.0,172.0,5.0,22.0
2122,"Bán nhà mặt tiền Phan Xích Long, P.2, Q.Phú Nhuận, DT 4mx16m, Hầm 5 lầu, chỉ 32 tỷ TL",9.0,64.0,30.0,32.0,6.0,5.0,334.0,12.0,20.0
2123,"Bán nhà mặt tiền Phan Huy Ích, P.15, Q.Tân Bình, DT 7.1m x 33m, Giá bán chỉ 31.5 tỷ",9.0,210.0,20.0,31.5,2.0,1.0,326.0,8.0,22.0
2124,"Siêu phẩm Mặt tiền Trương Định, P.9, Q.3, DT 13x20m, Hầm 7Lầu, Giá bán 149 tỷ TL",9.0,238.0,30.0,149.0,8.0,8.0,419.0,26.0,10.0
2125,"Bán nhà Mặt tiền Trường Sa, P.2, Q.PN, DT 5x5m, 4 Lầu, Giá bán 10 tỷ TL",9.0,27.0,15.0,10.0,5.0,4.0,422.0,12.0,20.0
2126,"Bán nhà mặt tiền đường Trường Chinh, QTB, Gần đường Nguyễn Thái Bình, DT 7.5 x 38m NH 10m",9.0,260.0,20.0,35.0,1.0,1.0,420.0,5.0,22.0
2127,"Bán nhà mặt tiền Trương Quốc Dung - Nguyễn Văn Trỗi, Q.PN, DT 3.9m x 14m, 2 lầu, Giá chỉ 1",9.0,55.0,10.0,14.5,2.0,2.0,417.0,25.0,20.0
2128,"Bán nhà Mặt tiền Hai Bà Trưng, Q.1, DT 4.5x16m, HĐT cao 5.000USD/th, Giá bán 44 tỷ TL",9.0,70.0,20.0,44.0,5.0,4.0,110.0,102.0,5.0
2129,"Bán tòa nhà Văn Phòng Mặt Tiền 149 Trương Định,Q3,12.5x19m,Hầm + 8 tầng.Giá 135 Tỷ",9.0,229.0,50.0,135.0,30.0,10.0,419.0,24.0,10.0
2130,"Bán tòa nhà mặt tiền Trần Bình Trọng, Q. 5, DT 7.4x13m, Hầm 8 lầu, gần góc Nguyễn Trãi,",9.0,700.0,25.0,49.0,15.0,7.0,425.0,12.0,12.0
2131,"Bán nhà mặt tiền Hoa Lan, P.2, Q.PN, DT 4x16m, 3 lầu mới. Giá chỉ 20 tỷ",9.0,68.0,20.0,20.0,4.0,3.0,113.0,12.0,20.0
2132,"BÁN NHÀ QUẬN 3 CAO THẮNG - NTMK, GÓC 2 MẶT TIỀN 2 HẺM 8M DIỆN TÍCH 18 X 13M, GIÁ 52 TỶ",9.0,234.0,8.0,52.0,6.0,3.0,63.0,22.0,10.0
2133,"Bán nhà mặt tiền Trường Chinh, Q. Tân Bình, DT 4.5x20m. Giá bán chỉ 20 tỷ",9.0,90.0,20.0,20.0,1.0,1.0,420.0,6.0,22.0
2134,"Bán căn góc 2MT Cửu Long - Châu Thới, Q.10, DT: 4.1x10m, 2 lầu, TN: 35tr/tháng.giá 13 tỷ",9.0,41.0,20.0,13.0,1.0,2.0,87.0,8.0,6.0
2135,"Bán nhà mặt tiền Phạm Văn Hai, P2, Q.Tân Bình 4.3x20m, nhà 1 lầu giá 20 tỷ",9.0,90.0,20.0,20.0,1.0,1.0,351.0,12.0,22.0
2136,"BÁN NHÀ MT HAI BÀ TRƯNG, Q.1, DT 4.4mx18m, GIÁ CHO THUÊ CAO 5.000USD/THÁNG, GIÁ CHỈ 44 TỶ",9.0,90.0,20.0,44.0,4.0,4.0,230.0,102.0,5.0
2137,"Bán khách sạn Mặt tiền đường Nguyễn Thái Học, Q.1, DT 4,2x20m, Hầm 6 lầu, chỉ 53 tỷ",9.0,80.0,60.0,53.0,15.0,6.0,273.0,49.0,5.0
2138,"Bán nhà mặt tiền đường Phan Đăng Lưu, P. 1, Q, Phú Nhuận DT: 14m x 30m, 97.5 tỷ",9.0,404.0,30.0,97.5,12.0,12.0,336.0,2.0,20.0
2139,"MẶT TIỀN ĐỒNG XOÀI - HOÀNG HOA THÁM, P. 13, NGANG NỞ HẬU 5,65M DÀI 26M, 4 TẦNG MỚI,",9.0,267.0,10.0,17.5,6.0,3.0,574.0,6.0,22.0
2140,"Bán gấp nhà MT Nguyễn Hữu Cầu, P. Tân Định, Q. 1, DT: 6 x 22m (nở hậu 8m), giá: 55 tỷ",9.0,147.0,20.0,55.0,9.0,3.0,257.0,102.0,5.0
2141,"Bán mặt tiền đường C18 khu K300, P.12, Q.Tân Bình, DT 5.2x21m, XD Hầm 7 lầu, Giá 20.5 tỷ",9.0,106.0,30.0,20.5,4.0,2.0,60.0,5.0,22.0
2142,"Bán nhà mặt tiền nhánh Nguyễn Hồng Đào, P.14, Q.TB, DT 4x15m, 4 lầu mới, chỉ 12 tỷ",9.0,60.0,20.0,12.0,5.0,4.0,255.0,7.0,22.0
2143,"Tôi bán nhà MT Ngô Đức Kế, Bến Nghé Quận 1. DTCN: 112,5m2 trệt, 3 lầu HDT: 300,43tr",9.0,115.0,20.0,118.0,4.0,4.0,317.0,44.0,5.0
2144,"Bán nhà góc 2 MT Hoàng Văn Thụ, Q. Phú Nhuận, (6.5x20m) NH 10.5m, 4 lầu. Giá 33 tỷ TL",9.0,120.0,30.0,33.0,4.0,3.0,123.0,25.0,20.0
2145,"BÁN GẤP NHÀ Mặt Tiền đường NAM QUỐC CANG, Quận 1. DT 10x37m, Giá bán chỉ 145 tỷ TL",9.0,350.0,20.0,130.0,5.0,2.0,231.0,77.0,5.0
2146,"BÁN NHÀ MẶT TIỀN LÊ THỊ RIÊNG, P.BẾN THÀNH, Q1, CN 85M2 NGANG 6M HĐT 73,461 TRIỆU GIÁ 44.5",9.0,90.0,20.0,44.5,6.0,4.0,191.0,45.0,5.0
2147,"Bán tòa nhà building MT Tản Viên, P.2, Tân Bình, DT 28x20m, 2H + 12 lầu. Giá 488 tỷ",9.0,545.0,20.0,0.488,20.0,12.0,486.0,12.0,22.0
2148,"Bán nhà MT Tiền Giang, P2, Tân Bình DT 4,5x18m XD 3 lầu. Giá: 16 tỷ, cách Trường Sơn 30m",9.0,90.0,12.0,16.0,5.0,4.0,409.0,12.0,22.0
2149,"Bán tòa nhà CHDV đường Hoàng Văn Thụ, Q.TB, DT 8 x 31m, hầm 8 lầu. Giá 59 tỷ, LH Hồng Minh",9.0,252.0,10.0,57.0,12.0,8.0,123.0,21.0,22.0
2150,"Bán nhà 2Mặt tiền Hoàng Việt - Lê Bình, P.4, Q.TB, DT: 8,6x32m, XD hầm 9 Lầu. Giá chỉ 65 t",9.0,255.0,30.0,65.0,1.0,1.0,122.0,21.0,22.0
2151,"Bán siêu phẩm đắc địa đường Lê Lai, P.Bến Thành, Quận 1, DT 4x14m, 5 lầu,chỉ 34.5 tỷ",9.0,58.0,20.0,34.5,8.0,5.0,175.0,45.0,5.0
2152,"Bán nhà mặt tiền đường Tân Canh, P.1, QTân Bình. DT 6,1m x 20m. XD H 5L Giá chỉ 20.5 tỷ",9.0,126.0,20.0,20.5,2.0,2.0,457.0,2.0,22.0
2153,"BÁN NHÀ MẶT TIỀN KÝ CON, P. NTB QUẬN 1, DT 4X18M, 7 LẦU, sát chợ Bến Thành",9.0,72.0,20.0,38.9,18.0,7.0,159.0,66.0,5.0
2154,"Bán nhà mặt tiền Tân Canh, Tân Bình, Diện tích 12x20m, 2 lầu giá chỉ 44 tỷ",9.0,240.0,30.0,44.0,1.0,1.0,457.0,2.0,22.0
2155,"BÁN GẤP CĂN NHÀ ĐƯỜNG KỲ ĐỒNG, PHƯỜNG 9, Q 3. DT 11M X 30M DTCN 316M2 GIÁ: 55 TỶ",9.0,316.0,20.0,55.0,1.0,1.0,160.0,26.0,10.0
2156,"Bán nhà mặt tiền Lý Chính Thắng, p7, Q3. DT: (4 x 17m) 3 lầu mới - giá chỉ: 20 tỷ",9.0,72.0,20.0,20.0,4.0,3.0,211.0,24.0,10.0
2157,"Bán nhà 2MT HXH Lê Văn Việt, P.Long Thạnh Mỹ, Q.9, DT 10m x 20m, 4 lầu, đang cho thuê 100t",9.0,200.0,5.0,15.4,20.0,5.0,202.0,63.0,16.0
2158,"Bán nhà MT Nguyễn Văn Mai - Hai Bà Trưng, Q3. DT: 4.5x33m, NH: 5m, 5 lầu, giá chỉ 35 tỷ",9.0,145.0,10.0,35.0,8.0,5.0,297.0,25.0,10.0
2159,"Bán nhà mặt tiền đường Nguyễn Hồng Đào, P.14, Q.TB, DT 4x14.5m đúc 4 tấm, giá 11.5 tỷ TL",9.0,57.0,8.0,11.5,4.0,2.0,255.0,7.0,22.0
2160,"Bán nhà mặt tiền Lam Sơn, Tân Bình, 5x15m, 4 lầu. Giá 17.9 tỷ, ngay sân bay Tân Sơn Nhất",9.0,75.0,10.0,17.9,4.0,3.0,161.0,12.0,22.0
2161,"Bán nhà góc 2MT đường Trần Quang Diệu - Lê Văn Sỹ, Quận 3. DT: 5x20m 5 lầu mới xây, 24",9.0,100.0,20.0,24.0,5.0,5.0,437.0,6.0,10.0
2162,"Siêu phẩm tòa nhà Mặt tiền Hùng Vương, P.2, Q.10 DT 8x25m, 5 lầu, đang cho thuê 140tr/th,",9.0,200.0,30.0,53.5,6.0,5.0,139.0,12.0,6.0
2163,"bán nhà mặt tiền Trương Định DT: 12,5x19m 8 Tầng Giá 91 Tỷ.Quận 3",9.0,231.0,20.0,91.0,50.0,8.0,419.0,26.0,10.0
2164,"Bán nhà Mặt tiền Nguyễn Trọng Tuyển, P8, Q.PN, DT 3.2x12m, HĐ 30 triệu, 2 lầu, Giá chỉ 9.9",9.0,36.0,10.0,9.9,3.0,2.0,287.0,25.0,20.0
2165,"Bán tòa nhà Văn Phòng,Hoàng Văn Thụ,Phú Nhuận,12x26m,2 Hầm + 8 tầng,Giá 100 tỷ",9.0,350.0,30.0,100.0,50.0,10.0,123.0,25.0,20.0
2166,"Bán nhà Mặt tiền Bà Hạt - Nguyễn Tri Phương, P.9, Q10, DT 3.4x12m, 3 lầu nhà mới,11.4 tỷ",9.0,41.0,20.0,11.4,4.0,4.0,29.0,26.0,6.0
2167,"MT Nguyễn Đình Chiểu, Q. Phú Nhuận 6.5x 20.5m, 1Lau , Giá bán chỉ 25 tỷ TL",9.0,130.0,10.0,25.0,2.0,1.0,309.0,20.0,20.0
2168,"Bán nhà góc 2MT Hồ Biểu Chánh, P.11, Q.PN, DT 4.5x11m, 4 lầu mới đẹp vào ở ngay, Giá 13 tỷ",9.0,53.0,6.0,13.0,4.0,5.0,144.0,4.0,20.0
2169,"Bán nhà mặt tiền Trường Sơn, P.2, Q.Tân Bình DT 4mx29m, 2 lầu, Giá chỉ 17 tỷ",9.0,120.0,20.0,17.0,4.0,2.0,423.0,21.0,22.0
2170,"Bán nhà Mặt tiền Nguyễn Tri Phương, P.9, Q10, DT 3.3x12m, 2 lầu, Giá chỉ 11.5 tỷ",9.0,37.0,10.0,11.5,3.0,2.0,283.0,26.0,6.0
2171,"Bán nhà đường Hai Bà Trưng, P.8, Q.3, DT 3.5x12m, 2 lầu mới đẹp, Giá bán 9.7 tỷ TL",9.0,40.0,6.0,9.7,4.0,2.0,110.0,25.0,10.0
2172,"Bán nhà góc 2MT Nguyễn Văn Trỗi, P.11, Q.PN, DT 4.5x11m, 4 lầu mới đẹp vào ở ngay",9.0,45.0,6.0,12.9,4.0,4.0,302.0,4.0,20.0
2173,"Bán biệt thự ca sĩ siêu đẹp đường Huỳnh Văn Bánh, P.11, Q.Phú Nhuận, DT 10mx17m, 3 lầu",9.0,170.0,8.0,41.0,5.0,3.0,131.0,4.0,20.0
2174,"Bán nhà siêu đẹp 2MT Hai Bà Trưng, P.8, Q.3, DT 3.5x12m, 2 lầu mới đẹp như hình,",9.0,36.0,4.0,9.7,4.0,2.0,110.0,25.0,10.0
2175,"Bán nhà góc 2 mặt tiền đường Nguyễn Trọng Tuyển, 4.5x19m, 1 trệt 4 lầu giá 23.2 tỷ TL",9.0,86.0,10.0,23.2,8.0,4.0,287.0,2.0,22.0
2176,"Bán nhà đường Trần Huy Liệu, P.15, Q.Phú Nhuận, DT 3.9x18m, XD 5 tầng, Giá bán chỉ 11.2 tỷ",9.0,70.0,10.0,11.2,1.0,1.0,427.0,8.0,20.0
2177,"Bán nhà Mặt Tiền Lê Văn Sỹ- Phạm Văn Hai, P.2, Q.Tân Bình, DT 5x15m, 2 lầu, Giá bán 22.5 t",9.0,75.0,20.0,22.5,4.0,2.0,199.0,12.0,22.0
2178,"Bán nhà Mặt tiền Cao Thắng - Võ Văn Tần, P.3, Q.3, DT 15x60m, LH Hồng Minh",9.0,879.0,20.0,0.32,4.0,2.0,63.0,20.0,10.0
2179,"Bán khách sạn 4 sao Merperle Crystal Palace Phú Mỹ Hưng, Q.7 DT: 60x46m 2H+8L",9.0,2.7,40.0,0.52,80.0,9.0,261.0,92.0,14.0
2180,"Bán khách sạn mới xây góc 2MT Cửu Long - khu sân bay, P2, DT: 9x16m 1H, 7L 25p TN: 350tr.",9.0,144.0,8.0,36.0,30.0,5.0,87.0,12.0,22.0
2181,"Bán gấp nhà Mặt tiền đường Vĩnh Viễn, P.6, Q10, DT 3.6x11m, 3 lầu, giá chỉ 10,8 tỷ TL",9.0,30.0,10.0,10.8,4.0,3.0,502.0,23.0,6.0
2182,"Bán nhà Mặt tiền Trần Quang Khải, P.Tân Định, Q.1, DT 3.5x9m, 2 lầu, Giá bán 12,5 tỷ",9.0,25.0,10.0,12.5,3.0,2.0,438.0,102.0,5.0
2183,"Bán nhà HXH 194/ Võ Văn Tần, P.5, Q.3(2 chiều), DT 4m x 12m 3 lầu, giá bán 12 tỷ TL",9.0,48.0,5.0,12.0,4.0,4.0,499.0,22.0,10.0
2184,"Định cư Úc bán nhà HXH Đặng Văn Ngữ, P.10, Q.PN, DT 4.3m x12m, 3 lầu, giá chỉ 9.8 tỷ",9.0,50.0,8.0,9.8,4.0,2.0,571.0,3.0,20.0
2185,"Bán nhà HXH Đường Nguyễn Trọng Tuyển, Quận Tân Bình. DT 12x20m 1T 3L Giá 34 tỷ TL",9.0,220.0,6.0,34.0,4.0,2.0,287.0,2.0,22.0
2186,"Bán nhà HXH Tôn Thất Tùng, P.Phạm Ngũ Lão, Q.1, DT 8m x 20m, XD H 8L, Giá bán 32 tỷ",9.0,160.0,152.0,32.0,4.0,4.0,479.0,77.0,5.0
2187,"Bán nhà quận 3 Cao Thắng - Võ Văn Tần , góc 2 mặt tiền 2 hẻm 8m diện tích 18 x 13m, giá 55",9.0,234.0,8.0,55.0,5.0,3.0,499.0,22.0,10.0
2188,"Bán nhà siêu đẹp HXH Hai Bà Trưng, P.8, Q.3, DT 3.6x12m, 2 lầu mới đẹp như hình,Giá 9.7 tỷ",9.0,44.0,5.0,9.7,4.0,2.0,110.0,23.0,10.0
2189,"Cần bán nhà MTNB Nguyễn Thái Bình, P.12, Q.Tân Bình, 3.5x28m, 2 lầu, Giá bán chỉ 11.5 tỷ",9.0,91.0,8.0,11.5,4.0,2.0,272.0,5.0,22.0
2190,"Bán nhà khu K300 Tân Bình, hẻm trải nhựa rộng 8m, đường A4 DT 4.4x30m, 2 lầu, Giá chỉ 11.5",9.0,122.0,6.0,11.5,4.0,2.0,172.0,5.0,22.0
2191,"Cần bán gấp nhà gần đường A4, P12, Tân Bình, DT 122m2, 3 tầng, Giá chỉ 11.5 tỷ TL",9.0,122.0,6.0,11.5,4.0,2.0,22.0,5.0,22.0
2192,"Cần bán nhà HXH Nguyễn Thái Bình, P.12, Q.Tân Bình, 3.5x28m, 2 lầu, Giá bán chỉ 11.5 tỷ",9.0,91.0,8.0,11.5,4.0,3.0,272.0,5.0,22.0
2193,"Bán nhà 29 đường Đoàn Thị Điểm, P.1, Q.PN, DT 5.2m x 18m, NH 6.4m, Giá 18 tỷ TL",9.0,100.0,10.0,18.0,4.0,2.0,336.0,2.0,20.0
2194,"Bán nhà đường Hai Bà Trưng, P.Tân Định, Q.1, DT 3.5x12m, 2 lầu mới đẹp, Giá bán 9.7 tỷ TL",9.0,36.0,6.0,9.7,4.0,2.0,110.0,102.0,5.0
2195,"Bán nhà đường Bùi Thị Xuân, P.1, Q.Tân Bình, DT 8x20m, 2 lầu, Giá bán 17.2 tỷ TL",9.0,160.0,6.0,17.2,3.0,2.0,47.0,2.0,22.0
2196,"Bán gấp nhà mặt tiền trung tâm Quận Tân Bình, 60m2, giá chỉ 7 tỷ",9.0,60.0,15.0,7.0,4.0,2.0,33.0,24.0,22.0
2197,BÁN GẤP NHÀ MỚI PHAN XÍCH LONG - PHÚ NHUẬN 42M,9.0,42.0,3.0,5.0,4.0,4.0,334.0,20.0,20.0
2198,"Cần bán gấp nhà hẻm số 8 Đinh Bộ Lĩnh, P24, Quận Bình Thạnh",9.0,45.0,3.0,5.3,3.0,4.0,548.0,15.0,17.0
2199,"BÁN GẤP NHÀ MỚI TẠI XÔ VIẾT NGHỆ TĨNH, P.25, BÌNH THẠNH",9.0,48.0,4.0,5.95,4.0,4.0,513.0,16.0,17.0
2200,"BÁN NHÀ ĐẸP 3 TẦNG 44M2 HOÀNG VĂN THỤ, PHÚ NHUẬN CHỈ 4 TỶ 8",9.0,44.0,3.5,4.8,3.0,3.0,123.0,25.0,20.0
2201,"Bán gấp nhà đẹp đường Nguyễn Văn Đậu, Bình Thạnh, 4 tầng, hẻm ba gác thông, chỉ 4.9 tỷ",9.0,40.0,3.0,4.9,3.0,3.0,304.0,4.0,17.0
2202,"BÁN NHÀ 38m2 HẺM 3M LAM SƠN, P6, BÌNH THẠNH, 4.2 TỶ",9.0,33.0,3.0,3.8,3.0,3.0,161.0,23.0,17.0
2203,"Bán nhà hẻm 3m Nguyễn Thượng Hiền, P5, 37m2 1 trệt 3 lầu, 4.1 tỷ TL",9.0,37.0,3.0,4.1,4.0,4.0,275.0,22.0,20.0
2204,"Bán nhà hẻm đường Phan Đình Phùng, Phường 1, Quận Phú Nhuận. Giá 4.2 tỷ TL",9.0,37.0,3.0,4.2,4.0,4.0,335.0,2.0,20.0
2205,"Nhà 3 tầng 4.2x8m Phan Đình Phùng, Phú Nhuận chỉ 3 tỷ 7",9.0,32.0,3.0,3.7,3.0,3.0,335.0,2.0,20.0
